2025-11-29 23:15:10,444 DSP ADAPTIVE PIPELINE - SCHOLL_ARC83_N=83
2025-11-29 23:15:10,452 Loaded instance: scholl_arc83_n=83
2025-11-29 23:15:10,452 Loaded failures: 1
2025-11-29 23:15:10,452 [1/4] Loading instance and solving DSP...
2025-11-29 23:15:10,593 Nodes: 83, Edges: 113, Targets: 1, Solution: 83 operations
2025-11-29 23:15:10,593 Target(s) to achieve: ['C082']
2025-11-29 23:15:10,593 Starting disassembly sequence (83 operations)...
2025-11-29 23:15:10,593 [ 1/83] Disassembling C000... [OK]
2025-11-29 23:15:10,593 [ 2/83] Disassembling C001... [OK]
2025-11-29 23:15:10,593 [ 3/83] Disassembling C003... [OK]
2025-11-29 23:15:10,593 [ 4/83] Disassembling C002... [OK]
2025-11-29 23:15:10,593 [ 5/83] Disassembling C006... [OK]
2025-11-29 23:15:10,593 [ 6/83] Disassembling C005... [OK]
2025-11-29 23:15:10,593 [ 7/83] Disassembling C009... [OK]
2025-11-29 23:15:10,593 [ 8/83] Disassembling C004... [OK]
2025-11-29 23:15:10,593 [ 9/83] Disassembling C010... [OK]
2025-11-29 23:15:10,593 [10/83] Disassembling C013... [OK]
2025-11-29 23:15:10,593 [11/83] Disassembling C018... [OK]
2025-11-29 23:15:10,593 [12/83] Disassembling C024... [OK]
2025-11-29 23:15:10,593 [13/83] Disassembling C007... [OK]
2025-11-29 23:15:10,593 [14/83] Disassembling C008... [OK]
2025-11-29 23:15:10,593 [15/83] Disassembling C023... [OK]
2025-11-29 23:15:10,593 [16/83] Disassembling C014... [OK]
2025-11-29 23:15:10,593 [17/83] Disassembling C012... [OK]
2025-11-29 23:15:10,593 [18/83] Disassembling C028... [OK]
2025-11-29 23:15:10,593 [19/83] Disassembling C019... [OK]
2025-11-29 23:15:10,593 [20/83] Disassembling C025... [OK]
2025-11-29 23:15:10,593 [21/83] Disassembling C011... [OK]
2025-11-29 23:15:10,593 [22/83] Disassembling C016... [OK]
2025-11-29 23:15:10,593 [23/83] Disassembling C020... [OK]
2025-11-29 23:15:10,593 [24/83] Disassembling C015... [OK]
2025-11-29 23:15:10,593 [25/83] Disassembling C029... [OK]
2025-11-29 23:15:10,593 [26/83] Disassembling C017... [OK]
2025-11-29 23:15:10,593 [27/83] Disassembling C030... [OK]
2025-11-29 23:15:10,593 [28/83] Disassembling C027... [OK]
2025-11-29 23:15:10,593 [29/83] Disassembling C031... [OK]
2025-11-29 23:15:10,593 [30/83] Disassembling C033... [OK]
2025-11-29 23:15:10,593 [31/83] Disassembling C034... [OK]
2025-11-29 23:15:10,593 [32/83] Disassembling C021... [OK]
2025-11-29 23:15:10,593 [33/83] Disassembling C035... [OK]
2025-11-29 23:15:10,593 [34/83] Disassembling C022... [OK]
2025-11-29 23:15:10,593 [35/83] Disassembling C037... [OK]
2025-11-29 23:15:10,593 [36/83] Disassembling C032... [OK]
2025-11-29 23:15:10,593 [37/83] Disassembling C036... [OK]
2025-11-29 23:15:10,593 [38/83] Disassembling C040... [OK]
2025-11-29 23:15:10,593 [39/83] Disassembling C044... [OK]
2025-11-29 23:15:10,593 [40/83] Disassembling C026... [OK]
2025-11-29 23:15:10,593 [41/83] Disassembling C039... [OK]
2025-11-29 23:15:10,593 [42/83] Disassembling C046... [OK]
2025-11-29 23:15:10,593 [43/83] Disassembling C048... [OK]
2025-11-29 23:15:10,593 [44/83] Disassembling C068... [OK]
2025-11-29 23:15:10,593 [45/83] Disassembling C069... [OK]
2025-11-29 23:15:10,593 [46/83] Disassembling C070... [OK]
2025-11-29 23:15:10,593 [47/83] Disassembling C038... [OK]
2025-11-29 23:15:10,593 [48/83] Disassembling C042... [OK]
2025-11-29 23:15:10,593 [49/83] Disassembling C041... [OK]
2025-11-29 23:15:10,593 [50/83] Disassembling C071... [OK]
2025-11-29 23:15:10,593 [51/83] Disassembling C072... [OK]
2025-11-29 23:15:10,593 [52/83] Disassembling C043... [OK]
2025-11-29 23:15:10,593 [53/83] Disassembling C045... [OK]
2025-11-29 23:15:10,593 [54/83] Disassembling C047... [OK]
2025-11-29 23:15:10,593 [55/83] Disassembling C049... [OK]
2025-11-29 23:15:10,593 [56/83] Disassembling C050... [OK]
2025-11-29 23:15:10,593 [57/83] Disassembling C051... [OK]
2025-11-29 23:15:10,593 [58/83] Disassembling C052... [OK]
2025-11-29 23:15:10,593 [59/83] Disassembling C053... [OK]
2025-11-29 23:15:10,593 [60/83] Disassembling C054... [OK]
2025-11-29 23:15:10,593 [61/83] Disassembling C055... [OK]
2025-11-29 23:15:10,593 [62/83] Disassembling C056... [OK]
2025-11-29 23:15:10,593 [63/83] Disassembling C057... [OK]
2025-11-29 23:15:10,593 [64/83] Disassembling C058... [OK]
2025-11-29 23:15:10,593 [65/83] Disassembling C059... [OK]
2025-11-29 23:15:10,593 [66/83] Disassembling C060... [OK]
2025-11-29 23:15:10,593 [67/83] Disassembling C061... [OK]
2025-11-29 23:15:10,593 [68/83] Disassembling C062... [OK]
2025-11-29 23:15:10,593 [69/83] Disassembling C063... [OK]
2025-11-29 23:15:10,593 [70/83] Disassembling C064... [OK]
2025-11-29 23:15:10,593 [71/83] Disassembling C065... [OK]
2025-11-29 23:15:10,593 [72/83] Disassembling C066... [OK]
2025-11-29 23:15:10,593 [73/83] Disassembling C067... [OK]
2025-11-29 23:15:10,593 [74/83] Disassembling C074... [OK]
2025-11-29 23:15:10,593 [75/83] Disassembling C073... [OK]
2025-11-29 23:15:10,593 [76/83] Disassembling C075... [OK]
2025-11-29 23:15:10,593 [77/83] Disassembling C077... [OK]
2025-11-29 23:15:10,593 [78/83] Disassembling C076... [OK]
2025-11-29 23:15:10,593 [79/83] Disassembling C078... [OK]
2025-11-29 23:15:10,593 [80/83] Disassembling C079... [OK]
2025-11-29 23:15:10,593 [81/83] Disassembling C081... [OK]
2025-11-29 23:15:10,593 [82/83] Disassembling C080... [OK]
2025-11-29 23:15:10,593 [83/83] Disassembling C082... [OK]
2025-11-29 23:15:10,593 [2/4] Failure scenario loaded: 1 failure(s)
2025-11-29 23:15:10,593 [3/4] Executing adaptive scheduler...
2025-11-29 23:15:10,629 [FUZZY] Symptom: OVER_TORQUE_NO_ADVANCE
2025-11-29 23:15:10,629 [FUZZY] Inputs: force=70.0, torque=80.0, p_fail=85.0, context=0.0
2025-11-29 23:15:10,629 [FUZZY] Score: 71.71
2025-11-29 23:15:10,629 [FUZZY] Decision: destroy (confidence=59.1%)
2025-11-29 23:15:10,630 [ACTION] destroy: success=False, notes=Destruction non autorisée : Flag 'no_destroy' actif (contexte ou graphe).
2025-11-29 23:15:10,630 Adaptive scheduler finished. Actions taken: 2
2025-11-29 23:15:10,630 EXECUTION SUMMARY
2025-11-29 23:15:10,630 Status: SUCCESS
2025-11-29 23:15:10,630 Target components:
2025-11-29 23:15:10,630 [OK] C082 - Successfully disassembled
2025-11-29 23:15:10,630 Execution metrics:
2025-11-29 23:15:10,630 Targets achieved: 1/1 (100.0%)
2025-11-29 23:15:10,630 Failures handled: 1
2025-11-29 23:15:10,630 Actions taken: 2
2025-11-29 23:15:10,631 Components done: 82/83
2025-11-29 23:15:10,631 Locked: 1 component(s)
2025-11-29 23:15:10,631 Execution time: 0.19s
2025-11-29 23:15:10,631 Actions breakdown:
2025-11-29 23:15:10,631 [FAILED] C036     OVER_TORQUE_NO_ADVANCE -> destroy     
2025-11-29 23:15:10,631 [OK] C036     OVER_TORQUE_NO_ADVANCE -> destroy\u2192bypass
2025-11-29 23:15:10,631 Detailed logs: results\save\test_failures\scholl_arc83_n=83\simple
2025-11-29 23:15:10,632 Pipeline finished successfully
