2025-11-29 23:15:12,126 DSP ADAPTIVE PIPELINE - SCHOLL_LUTZ2_N=89
2025-11-29 23:15:12,127 Loaded instance: scholl_lutz2_n=89
2025-11-29 23:15:12,128 Loaded failures: 1
2025-11-29 23:15:12,129 [1/4] Loading instance and solving DSP...
2025-11-29 23:15:12,299 Nodes: 89, Edges: 118, Targets: 2, Solution: 88 operations
2025-11-29 23:15:12,299 Target(s) to achieve: ['C047', 'C087']
2025-11-29 23:15:12,299 Starting disassembly sequence (88 operations)...
2025-11-29 23:15:12,299 [ 1/88] Disassembling C000... [OK]
2025-11-29 23:15:12,299 [ 2/88] Disassembling C029... [OK]
2025-11-29 23:15:12,299 [ 3/88] Disassembling C001... [OK]
2025-11-29 23:15:12,300 [ 4/88] Disassembling C002... [OK]
2025-11-29 23:15:12,300 [ 5/88] Disassembling C003... [OK]
2025-11-29 23:15:12,300 [ 6/88] Disassembling C008... [OK]
2025-11-29 23:15:12,300 [ 7/88] Disassembling C006... [OK]
2025-11-29 23:15:12,300 [ 8/88] Disassembling C005... [OK]
2025-11-29 23:15:12,300 [ 9/88] Disassembling C007... [OK]
2025-11-29 23:15:12,300 [10/88] Disassembling C004... [OK]
2025-11-29 23:15:12,300 [11/88] Disassembling C010... [OK]
2025-11-29 23:15:12,300 [12/88] Disassembling C011... [OK]
2025-11-29 23:15:12,300 [13/88] Disassembling C009... [OK]
2025-11-29 23:15:12,300 [14/88] Disassembling C012... [OK]
2025-11-29 23:15:12,300 [15/88] Disassembling C013... [OK]
2025-11-29 23:15:12,300 [16/88] Disassembling C014... [OK]
2025-11-29 23:15:12,300 [17/88] Disassembling C016... [OK]
2025-11-29 23:15:12,300 [18/88] Disassembling C015... [OK]
2025-11-29 23:15:12,300 [19/88] Disassembling C017... [OK]
2025-11-29 23:15:12,300 [20/88] Disassembling C019... [OK]
2025-11-29 23:15:12,300 [21/88] Disassembling C018... [OK]
2025-11-29 23:15:12,300 [22/88] Disassembling C021... [OK]
2025-11-29 23:15:12,300 [23/88] Disassembling C022... [OK]
2025-11-29 23:15:12,300 [24/88] Disassembling C020... [OK]
2025-11-29 23:15:12,300 [25/88] Disassembling C027... [OK]
2025-11-29 23:15:12,300 [26/88] Disassembling C023... [OK]
2025-11-29 23:15:12,300 [27/88] Disassembling C053... [OK]
2025-11-29 23:15:12,301 [28/88] Disassembling C024... [OK]
2025-11-29 23:15:12,301 [29/88] Disassembling C054... [OK]
2025-11-29 23:15:12,301 [30/88] Disassembling C028... [OK]
2025-11-29 23:15:12,301 [31/88] Disassembling C030... [OK]
2025-11-29 23:15:12,301 [32/88] Disassembling C055... [OK]
2025-11-29 23:15:12,301 [33/88] Disassembling C025... [OK]
2025-11-29 23:15:12,301 [34/88] Disassembling C026... [OK]
2025-11-29 23:15:12,301 [35/88] Disassembling C056... [OK]
2025-11-29 23:15:12,301 [36/88] Disassembling C064... [OK]
2025-11-29 23:15:12,301 [37/88] Disassembling C057... [OK]
2025-11-29 23:15:12,301 [38/88] Disassembling C065... [OK]
2025-11-29 23:15:12,301 [39/88] Disassembling C059... [OK]
2025-11-29 23:15:12,301 [40/88] Disassembling C063... [OK]
2025-11-29 23:15:12,301 [41/88] Disassembling C058... [OK]
2025-11-29 23:15:12,301 [42/88] Disassembling C060... [OK]
2025-11-29 23:15:12,301 [43/88] Disassembling C031... [OK]
2025-11-29 23:15:12,301 [44/88] Disassembling C061... [OK]
2025-11-29 23:15:12,301 [45/88] Disassembling C032... [OK]
2025-11-29 23:15:12,301 [46/88] Disassembling C033... [OK]
2025-11-29 23:15:12,301 [47/88] Disassembling C034... [OK]
2025-11-29 23:15:12,301 [48/88] Disassembling C035... [OK]
2025-11-29 23:15:12,301 [49/88] Disassembling C036... [OK]
2025-11-29 23:15:12,301 [50/88] Disassembling C062... [OK]
2025-11-29 23:15:12,301 [51/88] Disassembling C066... [OK]
2025-11-29 23:15:12,301 [52/88] Disassembling C037... [OK]
2025-11-29 23:15:12,301 [53/88] Disassembling C038... [OK]
2025-11-29 23:15:12,301 [54/88] Disassembling C040... [OK]
2025-11-29 23:15:12,301 [55/88] Disassembling C042... [OK]
2025-11-29 23:15:12,301 [56/88] Disassembling C039... [OK]
2025-11-29 23:15:12,301 [57/88] Disassembling C043... [OK]
2025-11-29 23:15:12,301 [58/88] Disassembling C044... [OK]
2025-11-29 23:15:12,302 [59/88] Disassembling C045... [OK]
2025-11-29 23:15:12,302 [60/88] Disassembling C046... [OK]
2025-11-29 23:15:12,302 [61/88] Disassembling C047... [OK]
2025-11-29 23:15:12,302 [62/88] Disassembling C041... [OK]
2025-11-29 23:15:12,302 [63/88] Disassembling C048... [OK]
2025-11-29 23:15:12,302 [64/88] Disassembling C049... [OK]
2025-11-29 23:15:12,302 [65/88] Disassembling C050... [OK]
2025-11-29 23:15:12,302 [66/88] Disassembling C051... [OK]
2025-11-29 23:15:12,302 [67/88] Disassembling C052... [OK]
2025-11-29 23:15:12,302 [68/88] Disassembling C070... [OK]
2025-11-29 23:15:12,302 [69/88] Disassembling C072... [OK]
2025-11-29 23:15:12,302 [70/88] Disassembling C069... [OK]
2025-11-29 23:15:12,302 [71/88] Disassembling C068... [OK]
2025-11-29 23:15:12,302 [72/88] Disassembling C073... [OK]
2025-11-29 23:15:12,302 [73/88] Disassembling C075... [OK]
2025-11-29 23:15:12,302 [74/88] Disassembling C067... [OK]
2025-11-29 23:15:12,302 [75/88] Disassembling C074... [OK]
2025-11-29 23:15:12,302 [76/88] Disassembling C071... [OK]
2025-11-29 23:15:12,302 [77/88] Disassembling C076... [OK]
2025-11-29 23:15:12,302 [78/88] Disassembling C079... [OK]
2025-11-29 23:15:12,302 [79/88] Disassembling C077... [OK]
2025-11-29 23:15:12,302 [80/88] Disassembling C078... [OK]
2025-11-29 23:15:12,302 [81/88] Disassembling C080... [OK]
2025-11-29 23:15:12,302 [82/88] Disassembling C084... [OK]
2025-11-29 23:15:12,302 [83/88] Disassembling C083... [OK]
2025-11-29 23:15:12,302 [84/88] Disassembling C081... [OK]
2025-11-29 23:15:12,302 [85/88] Disassembling C082... [OK]
2025-11-29 23:15:12,302 [86/88] Disassembling C085... [OK]
2025-11-29 23:15:12,302 [87/88] Disassembling C086... [OK]
2025-11-29 23:15:12,303 [88/88] Disassembling C087... [OK]
2025-11-29 23:15:12,303 [2/4] Failure scenario loaded: 1 failure(s)
2025-11-29 23:15:12,303 [3/4] Executing adaptive scheduler...
2025-11-29 23:15:12,327 [FUZZY] Symptom: LOW_VALUE_BOTTLENECK
2025-11-29 23:15:12,327 [FUZZY] Inputs: force=30.0, torque=20.0, p_fail=60.0, context=0.0
2025-11-29 23:15:12,327 [FUZZY] Score: 40.00
2025-11-29 23:15:12,327 [FUZZY] Decision: bypass (confidence=100.0%)
2025-11-29 23:15:12,327 [ACTION] bypass: success=True, notes=Component C016 bypassed.
2025-11-29 23:15:12,328 Adaptive scheduler finished. Actions taken: 1
2025-11-29 23:15:12,328 EXECUTION SUMMARY
2025-11-29 23:15:12,328 Status: SUCCESS
2025-11-29 23:15:12,328 Target components:
2025-11-29 23:15:12,328 [OK] C047 - Successfully disassembled
2025-11-29 23:15:12,328 [OK] C087 - Successfully disassembled
2025-11-29 23:15:12,328 Execution metrics:
2025-11-29 23:15:12,328 Targets achieved: 2/2 (100.0%)
2025-11-29 23:15:12,328 Failures handled: 1
2025-11-29 23:15:12,328 Actions taken: 1
2025-11-29 23:15:12,328 Components done: 87/88
2025-11-29 23:15:12,328 Locked: 1 component(s)
2025-11-29 23:15:12,328 Execution time: 0.20s
2025-11-29 23:15:12,328 Actions breakdown:
2025-11-29 23:15:12,328 [OK] C016     LOW_VALUE_BOTTLENECK -> bypass      
2025-11-29 23:15:12,328 Detailed logs: results\save\test_failures\scholl_lutz2_n=89\simple
2025-11-29 23:15:12,332 Pipeline finished successfully
