2025-11-29 23:16:35,377 DSP ADAPTIVE PIPELINE - SCHOLL_KILBRID_N=45
2025-11-29 23:16:35,377 Loaded instance: scholl_kilbrid_n=45
2025-11-29 23:16:35,379 Loaded failures: 3
2025-11-29 23:16:35,379 [1/4] Loading instance and solving DSP...
2025-11-29 23:16:35,425 Nodes: 45, Edges: 62, Targets: 1, Solution: 42 operations
2025-11-29 23:16:35,425 Target(s) to achieve: ['C044']
2025-11-29 23:16:35,425 Starting disassembly sequence (42 operations)...
2025-11-29 23:16:35,425 [ 1/42] Disassembling C010... [OK]
2025-11-29 23:16:35,425 [ 2/42] Disassembling C000... [OK]
2025-11-29 23:16:35,425 [ 3/42] Disassembling C011... [OK]
2025-11-29 23:16:35,426 [ 4/42] Disassembling C006... [OK]
2025-11-29 23:16:35,426 [ 5/42] Disassembling C012... [OK]
2025-11-29 23:16:35,426 [ 6/42] Disassembling C038... [OK]
2025-11-29 23:16:35,426 [ 7/42] Disassembling C001... [OK]
2025-11-29 23:16:35,426 [ 8/42] Disassembling C002... [OK]
2025-11-29 23:16:35,426 [ 9/42] Disassembling C004... [OK]
2025-11-29 23:16:35,426 [10/42] Disassembling C007... [OK]
2025-11-29 23:16:35,426 [11/42] Disassembling C014... [OK]
2025-11-29 23:16:35,426 [12/42] Disassembling C013... [OK]
2025-11-29 23:16:35,426 [13/42] Disassembling C017... [OK]
2025-11-29 23:16:35,426 [14/42] Disassembling C031... [OK]
2025-11-29 23:16:35,426 [15/42] Disassembling C016... [OK]
2025-11-29 23:16:35,426 [16/42] Disassembling C023... [OK]
2025-11-29 23:16:35,426 [17/42] Disassembling C028... [OK]
2025-11-29 23:16:35,426 [18/42] Disassembling C003... [OK]
2025-11-29 23:16:35,426 [19/42] Disassembling C015... [OK]
2025-11-29 23:16:35,426 [20/42] Disassembling C030... [OK]
2025-11-29 23:16:35,426 [21/42] Disassembling C022... [OK]
2025-11-29 23:16:35,426 [22/42] Disassembling C029... [OK]
2025-11-29 23:16:35,426 [23/42] Disassembling C008... [OK]
2025-11-29 23:16:35,426 [24/42] Disassembling C024... [OK]
2025-11-29 23:16:35,426 [25/42] Disassembling C025... [OK]
2025-11-29 23:16:35,426 [26/42] Disassembling C005... [OK]
2025-11-29 23:16:35,426 [27/42] Disassembling C026... [OK]
2025-11-29 23:16:35,426 [28/42] Disassembling C018... [OK]
2025-11-29 23:16:35,426 [29/42] Disassembling C019... [OK]
2025-11-29 23:16:35,426 [30/42] Disassembling C020... [OK]
2025-11-29 23:16:35,426 [31/42] Disassembling C032... [OK]
2025-11-29 23:16:35,426 [32/42] Disassembling C034... [OK]
2025-11-29 23:16:35,426 [33/42] Disassembling C033... [OK]
2025-11-29 23:16:35,427 [34/42] Disassembling C009... [OK]
2025-11-29 23:16:35,427 [35/42] Disassembling C021... [OK]
2025-11-29 23:16:35,427 [36/42] Disassembling C035... [OK]
2025-11-29 23:16:35,427 [37/42] Disassembling C027... [OK]
2025-11-29 23:16:35,427 [38/42] Disassembling C037... [OK]
2025-11-29 23:16:35,427 [39/42] Disassembling C039... [OK]
2025-11-29 23:16:35,427 [40/42] Disassembling C040... [OK]
2025-11-29 23:16:35,427 [41/42] Disassembling C041... [OK]
2025-11-29 23:16:35,427 [42/42] Disassembling C044... [OK]
2025-11-29 23:16:35,427 [2/4] Failure scenario loaded: 3 failure(s)
2025-11-29 23:16:35,427 [3/4] Executing adaptive scheduler...
2025-11-29 23:16:35,448 [FUZZY] Symptom: OVER_TORQUE_NO_ADVANCE
2025-11-29 23:16:35,448 [FUZZY] Inputs: force=70.0, torque=80.0, p_fail=85.0, context=0.0
2025-11-29 23:16:35,448 [FUZZY] Score: 71.71
2025-11-29 23:16:35,448 [FUZZY] Decision: destroy (confidence=59.1%)
2025-11-29 23:16:35,449 [ACTION] destroy: success=False, notes=Destruction non autorisée : Flag 'no_destroy' actif (contexte ou graphe).
2025-11-29 23:16:35,496 [FUZZY] Symptom: LOW_VALUE_BOTTLENECK
2025-11-29 23:16:35,496 [FUZZY] Inputs: force=30.0, torque=20.0, p_fail=50.0, context=0.0
2025-11-29 23:16:35,496 [FUZZY] Score: 40.00
2025-11-29 23:16:35,496 [FUZZY] Decision: bypass (confidence=100.0%)
2025-11-29 23:16:35,497 [ACTION] bypass: success=False, notes=Aucun chemin alternatif dans le graphe.
2025-11-29 23:16:35,529 [FUZZY] Symptom: OVER_TORQUE_NO_ADVANCE
2025-11-29 23:16:35,530 [FUZZY] Inputs: force=70.0, torque=80.0, p_fail=85.0, context=0.0
2025-11-29 23:16:35,530 [FUZZY] Score: 71.71
2025-11-29 23:16:35,530 [FUZZY] Decision: destroy (confidence=59.1%)
2025-11-29 23:16:35,530 [ACTION] destroy: success=False, notes=Destruction non autorisée : Profit=22.00 > seuil=21.00 (percentile 20e).
2025-11-29 23:16:35,542 Adaptive scheduler finished. Actions taken: 6
2025-11-29 23:16:35,542 EXECUTION SUMMARY
2025-11-29 23:16:35,542 Status: SUCCESS
2025-11-29 23:16:35,542 Target components:
2025-11-29 23:16:35,542 [OK] C044 - Successfully disassembled
2025-11-29 23:16:35,542 Execution metrics:
2025-11-29 23:16:35,542 Targets achieved: 1/1 (100.0%)
2025-11-29 23:16:35,542 Failures handled: 3
2025-11-29 23:16:35,542 Actions taken: 6
2025-11-29 23:16:35,542 Components done: 39/42
2025-11-29 23:16:35,542 Locked: 3 component(s)
2025-11-29 23:16:35,542 Execution time: 0.17s
2025-11-29 23:16:35,542 Actions breakdown:
2025-11-29 23:16:35,542 [FAILED] C034     OVER_TORQUE_NO_ADVANCE -> destroy     
2025-11-29 23:16:35,542 [OK] C034     OVER_TORQUE_NO_ADVANCE -> destroy\u2192bypass
2025-11-29 23:16:35,542 [FAILED] C009     LOW_VALUE_BOTTLENECK -> bypass      
2025-11-29 23:16:35,542 [OK] C009     LOW_VALUE_BOTTLENECK -> bypass\u2192replan
2025-11-29 23:16:35,542 [FAILED] C021     OVER_TORQUE_NO_ADVANCE -> destroy     
2025-11-29 23:16:35,542 [OK] C021     OVER_TORQUE_NO_ADVANCE -> destroy\u2192replan
2025-11-29 23:16:35,543 Detailed logs: results\save\test_failures\scholl_kilbrid_n=45\complex
2025-11-29 23:16:35,545 Pipeline finished successfully
