2025-11-29 22:24:23,292 DSP ADAPTIVE PIPELINE - SCHOLL_LUTZ2_N=89
2025-11-29 22:24:23,292 Loaded instance: scholl_lutz2_n=89
2025-11-29 22:24:23,292 Loaded failures: 0
2025-11-29 22:24:23,292 [1/4] Loading instance and solving DSP...
2025-11-29 22:24:23,453 Nodes: 89, Edges: 118, Targets: 2, Solution: 88 operations
2025-11-29 22:24:23,453 Target(s) to achieve: ['C047', 'C087']
2025-11-29 22:24:23,453 Starting disassembly sequence (88 operations)...
2025-11-29 22:24:23,453 [ 1/88] Disassembling C029... [OK]
2025-11-29 22:24:23,453 [ 2/88] Disassembling C000... [OK]
2025-11-29 22:24:23,453 [ 3/88] Disassembling C001... [OK]
2025-11-29 22:24:23,453 [ 4/88] Disassembling C002... [OK]
2025-11-29 22:24:23,453 [ 5/88] Disassembling C003... [OK]
2025-11-29 22:24:23,453 [ 6/88] Disassembling C005... [OK]
2025-11-29 22:24:23,453 [ 7/88] Disassembling C004... [OK]
2025-11-29 22:24:23,453 [ 8/88] Disassembling C008... [OK]
2025-11-29 22:24:23,453 [ 9/88] Disassembling C009... [OK]
2025-11-29 22:24:23,453 [10/88] Disassembling C010... [OK]
2025-11-29 22:24:23,453 [11/88] Disassembling C006... [OK]
2025-11-29 22:24:23,453 [12/88] Disassembling C011... [OK]
2025-11-29 22:24:23,453 [13/88] Disassembling C007... [OK]
2025-11-29 22:24:23,453 [14/88] Disassembling C012... [OK]
2025-11-29 22:24:23,453 [15/88] Disassembling C013... [OK]
2025-11-29 22:24:23,453 [16/88] Disassembling C015... [OK]
2025-11-29 22:24:23,453 [17/88] Disassembling C014... [OK]
2025-11-29 22:24:23,453 [18/88] Disassembling C016... [OK]
2025-11-29 22:24:23,453 [19/88] Disassembling C017... [OK]
2025-11-29 22:24:23,453 [20/88] Disassembling C018... [OK]
2025-11-29 22:24:23,453 [21/88] Disassembling C019... [OK]
2025-11-29 22:24:23,453 [22/88] Disassembling C021... [OK]
2025-11-29 22:24:23,453 [23/88] Disassembling C020... [OK]
2025-11-29 22:24:23,453 [24/88] Disassembling C027... [OK]
2025-11-29 22:24:23,453 [25/88] Disassembling C053... [OK]
2025-11-29 22:24:23,453 [26/88] Disassembling C022... [OK]
2025-11-29 22:24:23,453 [27/88] Disassembling C023... [OK]
2025-11-29 22:24:23,453 [28/88] Disassembling C054... [OK]
2025-11-29 22:24:23,453 [29/88] Disassembling C055... [OK]
2025-11-29 22:24:23,453 [30/88] Disassembling C056... [OK]
2025-11-29 22:24:23,453 [31/88] Disassembling C063... [OK]
2025-11-29 22:24:23,453 [32/88] Disassembling C059... [OK]
2025-11-29 22:24:23,453 [33/88] Disassembling C060... [OK]
2025-11-29 22:24:23,453 [34/88] Disassembling C062... [OK]
2025-11-29 22:24:23,453 [35/88] Disassembling C058... [OK]
2025-11-29 22:24:23,453 [36/88] Disassembling C061... [OK]
2025-11-29 22:24:23,453 [37/88] Disassembling C024... [OK]
2025-11-29 22:24:23,453 [38/88] Disassembling C064... [OK]
2025-11-29 22:24:23,453 [39/88] Disassembling C065... [OK]
2025-11-29 22:24:23,453 [40/88] Disassembling C028... [OK]
2025-11-29 22:24:23,453 [41/88] Disassembling C026... [OK]
2025-11-29 22:24:23,453 [42/88] Disassembling C025... [OK]
2025-11-29 22:24:23,453 [43/88] Disassembling C030... [OK]
2025-11-29 22:24:23,453 [44/88] Disassembling C057... [OK]
2025-11-29 22:24:23,453 [45/88] Disassembling C066... [OK]
2025-11-29 22:24:23,453 [46/88] Disassembling C031... [OK]
2025-11-29 22:24:23,453 [47/88] Disassembling C032... [OK]
2025-11-29 22:24:23,453 [48/88] Disassembling C033... [OK]
2025-11-29 22:24:23,453 [49/88] Disassembling C034... [OK]
2025-11-29 22:24:23,453 [50/88] Disassembling C035... [OK]
2025-11-29 22:24:23,453 [51/88] Disassembling C036... [OK]
2025-11-29 22:24:23,453 [52/88] Disassembling C037... [OK]
2025-11-29 22:24:23,453 [53/88] Disassembling C038... [OK]
2025-11-29 22:24:23,453 [54/88] Disassembling C042... [OK]
2025-11-29 22:24:23,453 [55/88] Disassembling C039... [OK]
2025-11-29 22:24:23,453 [56/88] Disassembling C041... [OK]
2025-11-29 22:24:23,453 [57/88] Disassembling C043... [OK]
2025-11-29 22:24:23,453 [58/88] Disassembling C040... [OK]
2025-11-29 22:24:23,453 [59/88] Disassembling C044... [OK]
2025-11-29 22:24:23,453 [60/88] Disassembling C045... [OK]
2025-11-29 22:24:23,453 [61/88] Disassembling C046... [OK]
2025-11-29 22:24:23,453 [62/88] Disassembling C048... [OK]
2025-11-29 22:24:23,453 [63/88] Disassembling C047... [OK]
2025-11-29 22:24:23,453 [64/88] Disassembling C049... [OK]
2025-11-29 22:24:23,453 [65/88] Disassembling C050... [OK]
2025-11-29 22:24:23,453 [66/88] Disassembling C051... [OK]
2025-11-29 22:24:23,453 [67/88] Disassembling C052... [OK]
2025-11-29 22:24:23,453 [68/88] Disassembling C069... [OK]
2025-11-29 22:24:23,453 [69/88] Disassembling C068... [OK]
2025-11-29 22:24:23,453 [70/88] Disassembling C070... [OK]
2025-11-29 22:24:23,453 [71/88] Disassembling C067... [OK]
2025-11-29 22:24:23,453 [72/88] Disassembling C071... [OK]
2025-11-29 22:24:23,453 [73/88] Disassembling C079... [OK]
2025-11-29 22:24:23,453 [74/88] Disassembling C072... [OK]
2025-11-29 22:24:23,453 [75/88] Disassembling C073... [OK]
2025-11-29 22:24:23,453 [76/88] Disassembling C074... [OK]
2025-11-29 22:24:23,453 [77/88] Disassembling C075... [OK]
2025-11-29 22:24:23,453 [78/88] Disassembling C076... [OK]
2025-11-29 22:24:23,453 [79/88] Disassembling C077... [OK]
2025-11-29 22:24:23,453 [80/88] Disassembling C078... [OK]
2025-11-29 22:24:23,453 [81/88] Disassembling C080... [OK]
2025-11-29 22:24:23,453 [82/88] Disassembling C084... [OK]
2025-11-29 22:24:23,453 [83/88] Disassembling C083... [OK]
2025-11-29 22:24:23,453 [84/88] Disassembling C081... [OK]
2025-11-29 22:24:23,453 [85/88] Disassembling C082... [OK]
2025-11-29 22:24:23,453 [86/88] Disassembling C085... [OK]
2025-11-29 22:24:23,453 [87/88] Disassembling C086... [OK]
2025-11-29 22:24:23,453 [88/88] Disassembling C087... [OK]
2025-11-29 22:24:23,453 [2/4] No failures (nominal execution)
2025-11-29 22:24:23,453 [3/4] Executing adaptive scheduler...
2025-11-29 22:24:23,453 Adaptive scheduler finished. Actions taken: 0
2025-11-29 22:24:23,453 EXECUTION SUMMARY
2025-11-29 22:24:23,453 Status: SUCCESS
2025-11-29 22:24:23,453 Target components:
2025-11-29 22:24:23,453 [OK] C047 - Successfully disassembled
2025-11-29 22:24:23,453 [OK] C087 - Successfully disassembled
2025-11-29 22:24:23,453 Execution metrics:
2025-11-29 22:24:23,453 Targets achieved: 2/2 (100.0%)
2025-11-29 22:24:23,453 Failures handled: 0
2025-11-29 22:24:23,453 Actions taken: 0
2025-11-29 22:24:23,453 Components done: 88/88
2025-11-29 22:24:23,453 Execution time: 0.16s
2025-11-29 22:24:23,453 Detailed logs: results\save\test_nominal\scholl_lutz2_n=89
2025-11-29 22:24:23,453 Pipeline finished successfully
