2025-11-29 23:16:48,024 DSP ADAPTIVE PIPELINE - SCHOLL_LUTZ2_N=89
2025-11-29 23:16:48,026 Loaded instance: scholl_lutz2_n=89
2025-11-29 23:16:48,040 Loaded failures: 3
2025-11-29 23:16:48,040 [1/4] Loading instance and solving DSP...
2025-11-29 23:16:48,197 Nodes: 89, Edges: 118, Targets: 2, Solution: 88 operations
2025-11-29 23:16:48,197 Target(s) to achieve: ['C047', 'C087']
2025-11-29 23:16:48,197 Starting disassembly sequence (88 operations)...
2025-11-29 23:16:48,197 [ 1/88] Disassembling C029... [OK]
2025-11-29 23:16:48,197 [ 2/88] Disassembling C000... [OK]
2025-11-29 23:16:48,197 [ 3/88] Disassembling C001... [OK]
2025-11-29 23:16:48,197 [ 4/88] Disassembling C002... [OK]
2025-11-29 23:16:48,197 [ 5/88] Disassembling C003... [OK]
2025-11-29 23:16:48,197 [ 6/88] Disassembling C006... [OK]
2025-11-29 23:16:48,197 [ 7/88] Disassembling C007... [OK]
2025-11-29 23:16:48,197 [ 8/88] Disassembling C005... [OK]
2025-11-29 23:16:48,197 [ 9/88] Disassembling C004... [OK]
2025-11-29 23:16:48,197 [10/88] Disassembling C008... [OK]
2025-11-29 23:16:48,197 [11/88] Disassembling C010... [OK]
2025-11-29 23:16:48,197 [12/88] Disassembling C009... [OK]
2025-11-29 23:16:48,197 [13/88] Disassembling C011... [OK]
2025-11-29 23:16:48,197 [14/88] Disassembling C012... [OK]
2025-11-29 23:16:48,197 [15/88] Disassembling C013... [OK]
2025-11-29 23:16:48,197 [16/88] Disassembling C014... [OK]
2025-11-29 23:16:48,197 [17/88] Disassembling C016... [OK]
2025-11-29 23:16:48,197 [18/88] Disassembling C017... [OK]
2025-11-29 23:16:48,197 [19/88] Disassembling C015... [OK]
2025-11-29 23:16:48,197 [20/88] Disassembling C019... [OK]
2025-11-29 23:16:48,197 [21/88] Disassembling C018... [OK]
2025-11-29 23:16:48,197 [22/88] Disassembling C020... [OK]
2025-11-29 23:16:48,197 [23/88] Disassembling C053... [OK]
2025-11-29 23:16:48,197 [24/88] Disassembling C054... [OK]
2025-11-29 23:16:48,197 [25/88] Disassembling C027... [OK]
2025-11-29 23:16:48,197 [26/88] Disassembling C021... [OK]
2025-11-29 23:16:48,197 [27/88] Disassembling C055... [OK]
2025-11-29 23:16:48,197 [28/88] Disassembling C056... [OK]
2025-11-29 23:16:48,197 [29/88] Disassembling C062... [OK]
2025-11-29 23:16:48,197 [30/88] Disassembling C060... [OK]
2025-11-29 23:16:48,197 [31/88] Disassembling C057... [OK]
2025-11-29 23:16:48,197 [32/88] Disassembling C061... [OK]
2025-11-29 23:16:48,197 [33/88] Disassembling C065... [OK]
2025-11-29 23:16:48,197 [34/88] Disassembling C059... [OK]
2025-11-29 23:16:48,197 [35/88] Disassembling C064... [OK]
2025-11-29 23:16:48,197 [36/88] Disassembling C058... [OK]
2025-11-29 23:16:48,197 [37/88] Disassembling C022... [OK]
2025-11-29 23:16:48,197 [38/88] Disassembling C023... [OK]
2025-11-29 23:16:48,197 [39/88] Disassembling C024... [OK]
2025-11-29 23:16:48,197 [40/88] Disassembling C026... [OK]
2025-11-29 23:16:48,197 [41/88] Disassembling C063... [OK]
2025-11-29 23:16:48,197 [42/88] Disassembling C028... [OK]
2025-11-29 23:16:48,197 [43/88] Disassembling C025... [OK]
2025-11-29 23:16:48,197 [44/88] Disassembling C066... [OK]
2025-11-29 23:16:48,197 [45/88] Disassembling C030... [OK]
2025-11-29 23:16:48,197 [46/88] Disassembling C031... [OK]
2025-11-29 23:16:48,197 [47/88] Disassembling C032... [OK]
2025-11-29 23:16:48,197 [48/88] Disassembling C033... [OK]
2025-11-29 23:16:48,197 [49/88] Disassembling C034... [OK]
2025-11-29 23:16:48,197 [50/88] Disassembling C036... [OK]
2025-11-29 23:16:48,197 [51/88] Disassembling C035... [OK]
2025-11-29 23:16:48,197 [52/88] Disassembling C037... [OK]
2025-11-29 23:16:48,197 [53/88] Disassembling C038... [OK]
2025-11-29 23:16:48,197 [54/88] Disassembling C041... [OK]
2025-11-29 23:16:48,197 [55/88] Disassembling C042... [OK]
2025-11-29 23:16:48,197 [56/88] Disassembling C040... [OK]
2025-11-29 23:16:48,197 [57/88] Disassembling C039... [OK]
2025-11-29 23:16:48,197 [58/88] Disassembling C043... [OK]
2025-11-29 23:16:48,197 [59/88] Disassembling C044... [OK]
2025-11-29 23:16:48,197 [60/88] Disassembling C045... [OK]
2025-11-29 23:16:48,197 [61/88] Disassembling C046... [OK]
2025-11-29 23:16:48,197 [62/88] Disassembling C048... [OK]
2025-11-29 23:16:48,197 [63/88] Disassembling C047... [OK]
2025-11-29 23:16:48,197 [64/88] Disassembling C049... [OK]
2025-11-29 23:16:48,197 [65/88] Disassembling C050... [OK]
2025-11-29 23:16:48,197 [66/88] Disassembling C051... [OK]
2025-11-29 23:16:48,197 [67/88] Disassembling C052... [OK]
2025-11-29 23:16:48,197 [68/88] Disassembling C070... [OK]
2025-11-29 23:16:48,197 [69/88] Disassembling C068... [OK]
2025-11-29 23:16:48,197 [70/88] Disassembling C067... [OK]
2025-11-29 23:16:48,197 [71/88] Disassembling C072... [OK]
2025-11-29 23:16:48,197 [72/88] Disassembling C073... [OK]
2025-11-29 23:16:48,197 [73/88] Disassembling C075... [OK]
2025-11-29 23:16:48,197 [74/88] Disassembling C069... [OK]
2025-11-29 23:16:48,197 [75/88] Disassembling C074... [OK]
2025-11-29 23:16:48,197 [76/88] Disassembling C076... [OK]
2025-11-29 23:16:48,197 [77/88] Disassembling C071... [OK]
2025-11-29 23:16:48,197 [78/88] Disassembling C077... [OK]
2025-11-29 23:16:48,197 [79/88] Disassembling C079... [OK]
2025-11-29 23:16:48,197 [80/88] Disassembling C078... [OK]
2025-11-29 23:16:48,197 [81/88] Disassembling C080... [OK]
2025-11-29 23:16:48,197 [82/88] Disassembling C084... [OK]
2025-11-29 23:16:48,197 [83/88] Disassembling C083... [OK]
2025-11-29 23:16:48,197 [84/88] Disassembling C081... [OK]
2025-11-29 23:16:48,197 [85/88] Disassembling C082... [OK]
2025-11-29 23:16:48,197 [86/88] Disassembling C085... [OK]
2025-11-29 23:16:48,197 [87/88] Disassembling C086... [OK]
2025-11-29 23:16:48,197 [88/88] Disassembling C087... [OK]
2025-11-29 23:16:48,197 [2/4] Failure scenario loaded: 3 failure(s)
2025-11-29 23:16:48,197 [3/4] Executing adaptive scheduler...
2025-11-29 23:16:48,223 [FUZZY] Symptom: LOW_VALUE_BOTTLENECK
2025-11-29 23:16:48,223 [FUZZY] Inputs: force=30.0, torque=20.0, p_fail=50.0, context=0.0
2025-11-29 23:16:48,223 [FUZZY] Score: 40.00
2025-11-29 23:16:48,223 [FUZZY] Decision: bypass (confidence=100.0%)
2025-11-29 23:16:48,224 [ACTION] bypass: success=True, notes=Component C019 bypassed.
2025-11-29 23:16:48,276 [FUZZY] Symptom: LOW_VALUE_BOTTLENECK
2025-11-29 23:16:48,276 [FUZZY] Inputs: force=30.0, torque=20.0, p_fail=40.0, context=0.0
2025-11-29 23:16:48,276 [FUZZY] Score: 40.00
2025-11-29 23:16:48,276 [FUZZY] Decision: bypass (confidence=100.0%)
2025-11-29 23:16:48,276 [ACTION] bypass: success=False, notes=Aucun chemin alternatif dans le graphe.
2025-11-29 23:16:48,302 [FUZZY] Symptom: OVER_TORQUE_NO_ADVANCE
2025-11-29 23:16:48,302 [FUZZY] Inputs: force=70.0, torque=80.0, p_fail=75.0, context=0.0
2025-11-29 23:16:48,302 [FUZZY] Score: 70.67
2025-11-29 23:16:48,302 [FUZZY] Decision: destroy (confidence=63.7%)
2025-11-29 23:16:48,302 [ACTION] destroy: success=False, notes=Destruction non autorisée : Profit=95.00 > seuil=14.00 (percentile 20e).
2025-11-29 23:16:48,304 Adaptive scheduler finished. Actions taken: 4
2025-11-29 23:16:48,304 EXECUTION SUMMARY
2025-11-29 23:16:48,304 Status: SUCCESS
2025-11-29 23:16:48,304 Target components:
2025-11-29 23:16:48,304 [OK] C047 - Successfully disassembled
2025-11-29 23:16:48,304 [OK] C087 - Successfully disassembled
2025-11-29 23:16:48,304 Execution metrics:
2025-11-29 23:16:48,304 Targets achieved: 2/2 (100.0%)
2025-11-29 23:16:48,304 Failures handled: 3
2025-11-29 23:16:48,304 Actions taken: 4
2025-11-29 23:16:48,304 Components done: 85/88
2025-11-29 23:16:48,304 Locked: 3 component(s)
2025-11-29 23:16:48,304 Execution time: 0.28s
2025-11-29 23:16:48,304 Actions breakdown:
2025-11-29 23:16:48,304 [OK] C019     LOW_VALUE_BOTTLENECK -> bypass      
2025-11-29 23:16:48,304 [FAILED] C048     LOW_VALUE_BOTTLENECK -> bypass      
2025-11-29 23:16:48,304 [FAILED] C073     OVER_TORQUE_NO_ADVANCE -> destroy     
2025-11-29 23:16:48,304 [OK] C073     OVER_TORQUE_NO_ADVANCE -> destroy\u2192bypass
2025-11-29 23:16:48,304 Detailed logs: results\save\test_failures\scholl_lutz2_n=89\complex
2025-11-29 23:16:48,306 Pipeline finished successfully
