2025-11-29 23:16:19,889 DSP ADAPTIVE PIPELINE - SCHOLL_BARTHOLD_N=148
2025-11-29 23:16:19,891 Loaded instance: scholl_barthold_n=148
2025-11-29 23:16:19,892 Loaded failures: 2
2025-11-29 23:16:19,892 [1/4] Loading instance and solving DSP...
2025-11-29 23:16:19,988 Nodes: 148, Edges: 175, Targets: 1, Solution: 56 operations
2025-11-29 23:16:19,988 Target(s) to achieve: ['C125']
2025-11-29 23:16:19,988 Starting disassembly sequence (56 operations)...
2025-11-29 23:16:19,988 [ 1/56] Disassembling C031... [OK]
2025-11-29 23:16:19,988 [ 2/56] Disassembling C058... [OK]
2025-11-29 23:16:19,988 [ 3/56] Disassembling C073... [OK]
2025-11-29 23:16:19,989 [ 4/56] Disassembling C032... [OK]
2025-11-29 23:16:19,989 [ 5/56] Disassembling C000... [OK]
2025-11-29 23:16:19,989 [ 6/56] Disassembling C055... [OK]
2025-11-29 23:16:19,989 [ 7/56] Disassembling C033... [OK]
2025-11-29 23:16:19,989 [ 8/56] Disassembling C074... [OK]
2025-11-29 23:16:19,989 [ 9/56] Disassembling C072... [OK]
2025-11-29 23:16:19,989 [10/56] Disassembling C034... [OK]
2025-11-29 23:16:19,989 [11/56] Disassembling C001... [OK]
2025-11-29 23:16:19,989 [12/56] Disassembling C002... [OK]
2025-11-29 23:16:19,989 [13/56] Disassembling C006... [OK]
2025-11-29 23:16:19,990 [14/56] Disassembling C004... [OK]
2025-11-29 23:16:19,990 [15/56] Disassembling C005... [OK]
2025-11-29 23:16:19,990 [16/56] Disassembling C008... [OK]
2025-11-29 23:16:19,990 [17/56] Disassembling C003... [OK]
2025-11-29 23:16:19,990 [18/56] Disassembling C007... [OK]
2025-11-29 23:16:19,990 [19/56] Disassembling C009... [OK]
2025-11-29 23:16:19,990 [20/56] Disassembling C013... [OK]
2025-11-29 23:16:19,990 [21/56] Disassembling C015... [OK]
2025-11-29 23:16:19,990 [22/56] Disassembling C014... [OK]
2025-11-29 23:16:19,990 [23/56] Disassembling C016... [OK]
2025-11-29 23:16:19,990 [24/56] Disassembling C017... [OK]
2025-11-29 23:16:19,990 [25/56] Disassembling C018... [OK]
2025-11-29 23:16:19,990 [26/56] Disassembling C019... [OK]
2025-11-29 23:16:19,990 [27/56] Disassembling C021... [OK]
2025-11-29 23:16:19,990 [28/56] Disassembling C020... [OK]
2025-11-29 23:16:19,990 [29/56] Disassembling C023... [OK]
2025-11-29 23:16:19,990 [30/56] Disassembling C022... [OK]
2025-11-29 23:16:19,990 [31/56] Disassembling C026... [OK]
2025-11-29 23:16:19,990 [32/56] Disassembling C024... [OK]
2025-11-29 23:16:19,990 [33/56] Disassembling C025... [OK]
2025-11-29 23:16:19,990 [34/56] Disassembling C027... [OK]
2025-11-29 23:16:19,991 [35/56] Disassembling C028... [OK]
2025-11-29 23:16:19,991 [36/56] Disassembling C030... [OK]
2025-11-29 23:16:19,991 [37/56] Disassembling C035... [OK]
2025-11-29 23:16:19,991 [38/56] Disassembling C036... [OK]
2025-11-29 23:16:19,991 [39/56] Disassembling C037... [OK]
2025-11-29 23:16:19,991 [40/56] Disassembling C038... [OK]
2025-11-29 23:16:19,991 [41/56] Disassembling C039... [OK]
2025-11-29 23:16:19,991 [42/56] Disassembling C044... [OK]
2025-11-29 23:16:19,991 [43/56] Disassembling C045... [OK]
2025-11-29 23:16:19,991 [44/56] Disassembling C046... [OK]
2025-11-29 23:16:19,991 [45/56] Disassembling C053... [OK]
2025-11-29 23:16:19,991 [46/56] Disassembling C089... [OK]
2025-11-29 23:16:19,991 [47/56] Disassembling C110... [OK]
2025-11-29 23:16:19,991 [48/56] Disassembling C111... [OK]
2025-11-29 23:16:19,991 [49/56] Disassembling C112... [OK]
2025-11-29 23:16:19,991 [50/56] Disassembling C119... [OK]
2025-11-29 23:16:19,991 [51/56] Disassembling C115... [OK]
2025-11-29 23:16:19,991 [52/56] Disassembling C120... [OK]
2025-11-29 23:16:19,991 [53/56] Disassembling C121... [OK]
2025-11-29 23:16:19,991 [54/56] Disassembling C116... [OK]
2025-11-29 23:16:19,991 [55/56] Disassembling C117... [OK]
2025-11-29 23:16:19,991 [56/56] Disassembling C125... [OK]
2025-11-29 23:16:19,991 [2/4] Failure scenario loaded: 2 failure(s)
2025-11-29 23:16:19,991 [3/4] Executing adaptive scheduler...
2025-11-29 23:16:20,042 [FUZZY] Symptom: OVER_TORQUE_NO_ADVANCE
2025-11-29 23:16:20,042 [FUZZY] Inputs: force=70.0, torque=80.0, p_fail=65.0, context=0.0
2025-11-29 23:16:20,042 [FUZZY] Score: 65.47
2025-11-29 23:16:20,042 [FUZZY] Decision: destroy (confidence=86.8%)
2025-11-29 23:16:20,043 [ACTION] destroy: success=False, notes=Destruction non autorisée : Flag 'no_destroy' actif (contexte ou graphe).
2025-11-29 23:16:20,043 Adaptive scheduler finished. Actions taken: 2
2025-11-29 23:16:20,043 EXECUTION SUMMARY
2025-11-29 23:16:20,043 Status: SUCCESS
2025-11-29 23:16:20,043 Target components:
2025-11-29 23:16:20,043 [OK] C125 - Successfully disassembled
2025-11-29 23:16:20,043 Execution metrics:
2025-11-29 23:16:20,043 Targets achieved: 1/1 (100.0%)
2025-11-29 23:16:20,044 Failures handled: 2
2025-11-29 23:16:20,044 Actions taken: 2
2025-11-29 23:16:20,044 Components done: 55/56
2025-11-29 23:16:20,044 Locked: 1 component(s)
2025-11-29 23:16:20,044 Execution time: 0.16s
2025-11-29 23:16:20,044 Actions breakdown:
2025-11-29 23:16:20,044 [FAILED] C112     OVER_TORQUE_NO_ADVANCE -> destroy     
2025-11-29 23:16:20,044 [OK] C112     OVER_TORQUE_NO_ADVANCE -> destroy\u2192bypass
2025-11-29 23:16:20,044 Detailed logs: results\save\test_failures\scholl_barthold_n=148\intermediate
2025-11-29 23:16:20,047 Pipeline finished successfully
