2025-11-29 23:16:41,453 DSP ADAPTIVE PIPELINE - SCHOLL_TONGE70_N=70
2025-11-29 23:16:41,454 Loaded instance: scholl_tonge70_n=70
2025-11-29 23:16:41,471 Loaded failures: 3
2025-11-29 23:16:41,471 [1/4] Loading instance and solving DSP...
2025-11-29 23:16:41,530 Nodes: 70, Edges: 86, Targets: 2, Solution: 40 operations
2025-11-29 23:16:41,530 Target(s) to achieve: ['C010', 'C054']
2025-11-29 23:16:41,530 Starting disassembly sequence (40 operations)...
2025-11-29 23:16:41,530 [ 1/40] Disassembling C004... [OK]
2025-11-29 23:16:41,530 [ 2/40] Disassembling C008... [OK]
2025-11-29 23:16:41,530 [ 3/40] Disassembling C029... [OK]
2025-11-29 23:16:41,530 [ 4/40] Disassembling C000... [OK]
2025-11-29 23:16:41,530 [ 5/40] Disassembling C009... [OK]
2025-11-29 23:16:41,530 [ 6/40] Disassembling C010... [OK]
2025-11-29 23:16:41,530 [ 7/40] Disassembling C014... [OK]
2025-11-29 23:16:41,530 [ 8/40] Disassembling C001... [OK]
2025-11-29 23:16:41,530 [ 9/40] Disassembling C002... [OK]
2025-11-29 23:16:41,530 [10/40] Disassembling C015... [OK]
2025-11-29 23:16:41,530 [11/40] Disassembling C003... [OK]
2025-11-29 23:16:41,530 [12/40] Disassembling C023... [OK]
2025-11-29 23:16:41,530 [13/40] Disassembling C006... [OK]
2025-11-29 23:16:41,530 [14/40] Disassembling C005... [OK]
2025-11-29 23:16:41,530 [15/40] Disassembling C016... [OK]
2025-11-29 23:16:41,530 [16/40] Disassembling C007... [OK]
2025-11-29 23:16:41,530 [17/40] Disassembling C017... [OK]
2025-11-29 23:16:41,530 [18/40] Disassembling C018... [OK]
2025-11-29 23:16:41,530 [19/40] Disassembling C019... [OK]
2025-11-29 23:16:41,530 [20/40] Disassembling C021... [OK]
2025-11-29 23:16:41,530 [21/40] Disassembling C011... [OK]
2025-11-29 23:16:41,530 [22/40] Disassembling C013... [OK]
2025-11-29 23:16:41,530 [23/40] Disassembling C020... [OK]
2025-11-29 23:16:41,530 [24/40] Disassembling C012... [OK]
2025-11-29 23:16:41,530 [25/40] Disassembling C022... [OK]
2025-11-29 23:16:41,530 [26/40] Disassembling C030... [OK]
2025-11-29 23:16:41,530 [27/40] Disassembling C032... [OK]
2025-11-29 23:16:41,530 [28/40] Disassembling C033... [OK]
2025-11-29 23:16:41,530 [29/40] Disassembling C024... [OK]
2025-11-29 23:16:41,530 [30/40] Disassembling C026... [OK]
2025-11-29 23:16:41,530 [31/40] Disassembling C025... [OK]
2025-11-29 23:16:41,530 [32/40] Disassembling C031... [OK]
2025-11-29 23:16:41,530 [33/40] Disassembling C027... [OK]
2025-11-29 23:16:41,531 [34/40] Disassembling C028... [OK]
2025-11-29 23:16:41,531 [35/40] Disassembling C034... [OK]
2025-11-29 23:16:41,531 [36/40] Disassembling C050... [OK]
2025-11-29 23:16:41,531 [37/40] Disassembling C052... [OK]
2025-11-29 23:16:41,531 [38/40] Disassembling C051... [OK]
2025-11-29 23:16:41,531 [39/40] Disassembling C053... [OK]
2025-11-29 23:16:41,531 [40/40] Disassembling C054... [OK]
2025-11-29 23:16:41,531 [2/4] Failure scenario loaded: 3 failure(s)
2025-11-29 23:16:41,531 [3/4] Executing adaptive scheduler...
2025-11-29 23:16:41,553 [FUZZY] Symptom: OVER_TORQUE_NO_ADVANCE
2025-11-29 23:16:41,553 [FUZZY] Inputs: force=70.0, torque=80.0, p_fail=85.0, context=0.0
2025-11-29 23:16:41,553 [FUZZY] Score: 71.71
2025-11-29 23:16:41,553 [FUZZY] Decision: destroy (confidence=59.1%)
2025-11-29 23:16:41,553 [ACTION] destroy: success=False, notes=Destruction non autorisée : Profit=84.00 > seuil=21.00 (percentile 20e).
2025-11-29 23:16:41,600 [FUZZY] Symptom: OVER_TORQUE_NO_ADVANCE
2025-11-29 23:16:41,600 [FUZZY] Inputs: force=70.0, torque=80.0, p_fail=85.0, context=0.0
2025-11-29 23:16:41,600 [FUZZY] Score: 71.71
2025-11-29 23:16:41,600 [FUZZY] Decision: destroy (confidence=59.1%)
2025-11-29 23:16:41,600 [ACTION] destroy: success=False, notes=Destruction non autorisée : Flag 'no_destroy' actif (contexte ou graphe).
2025-11-29 23:16:41,619 [FUZZY] Symptom: LOW_VALUE_BOTTLENECK
2025-11-29 23:16:41,619 [FUZZY] Inputs: force=30.0, torque=20.0, p_fail=50.0, context=0.0
2025-11-29 23:16:41,619 [FUZZY] Score: 40.00
2025-11-29 23:16:41,619 [FUZZY] Decision: bypass (confidence=100.0%)
2025-11-29 23:16:41,619 [ACTION] bypass: success=False, notes=Aucun chemin alternatif dans le graphe.
2025-11-29 23:16:41,640 Adaptive scheduler finished. Actions taken: 6
2025-11-29 23:16:41,640 EXECUTION SUMMARY
2025-11-29 23:16:41,640 Status: SUCCESS
2025-11-29 23:16:41,640 Target components:
2025-11-29 23:16:41,640 [OK] C010 - Successfully disassembled
2025-11-29 23:16:41,640 [OK] C054 - Successfully disassembled
2025-11-29 23:16:41,641 Execution metrics:
2025-11-29 23:16:41,641 Targets achieved: 2/2 (100.0%)
2025-11-29 23:16:41,641 Failures handled: 3
2025-11-29 23:16:41,641 Actions taken: 6
2025-11-29 23:16:41,641 Components done: 37/40
2025-11-29 23:16:41,641 Locked: 3 component(s)
2025-11-29 23:16:41,641 Execution time: 0.19s
2025-11-29 23:16:41,641 Actions breakdown:
2025-11-29 23:16:41,641 [FAILED] C012     OVER_TORQUE_NO_ADVANCE -> destroy     
2025-11-29 23:16:41,641 [OK] C012     OVER_TORQUE_NO_ADVANCE -> destroy\u2192bypass
2025-11-29 23:16:41,641 [FAILED] C022     OVER_TORQUE_NO_ADVANCE -> destroy     
2025-11-29 23:16:41,641 [OK] C022     OVER_TORQUE_NO_ADVANCE -> destroy\u2192bypass
2025-11-29 23:16:41,641 [FAILED] C030     LOW_VALUE_BOTTLENECK -> bypass      
2025-11-29 23:16:41,641 [OK] C030     LOW_VALUE_BOTTLENECK -> bypass\u2192replan
2025-11-29 23:16:41,641 Detailed logs: results\save\test_failures\scholl_tonge70_n=70\complex
2025-11-29 23:16:41,643 Pipeline finished successfully
