2025-11-29 23:15:16,841 DSP ADAPTIVE PIPELINE - SCHOLL_MUKHERJE_N=94
2025-11-29 23:15:16,843 Loaded instance: scholl_mukherje_n=94
2025-11-29 23:15:16,843 Loaded failures: 1
2025-11-29 23:15:16,843 [1/4] Loading instance and solving DSP...
2025-11-29 23:15:17,026 Nodes: 94, Edges: 181, Targets: 1, Solution: 87 operations
2025-11-29 23:15:17,026 Target(s) to achieve: ['C086']
2025-11-29 23:15:17,026 Starting disassembly sequence (87 operations)...
2025-11-29 23:15:17,026 [ 1/87] Disassembling C000... [OK]
2025-11-29 23:15:17,026 [ 2/87] Disassembling C008... [OK]
2025-11-29 23:15:17,026 [ 3/87] Disassembling C006... [OK]
2025-11-29 23:15:17,027 [ 4/87] Disassembling C002... [OK]
2025-11-29 23:15:17,027 [ 5/87] Disassembling C011... [OK]
2025-11-29 23:15:17,027 [ 6/87] Disassembling C007... [OK]
2025-11-29 23:15:17,027 [ 7/87] Disassembling C001... [OK]
2025-11-29 23:15:17,027 [ 8/87] Disassembling C003... [OK]
2025-11-29 23:15:17,027 [ 9/87] Disassembling C016... [OK]
2025-11-29 23:15:17,027 [10/87] Disassembling C005... [OK]
2025-11-29 23:15:17,027 [11/87] Disassembling C004... [OK]
2025-11-29 23:15:17,027 [12/87] Disassembling C009... [OK]
2025-11-29 23:15:17,027 [13/87] Disassembling C010... [OK]
2025-11-29 23:15:17,027 [14/87] Disassembling C014... [OK]
2025-11-29 23:15:17,027 [15/87] Disassembling C017... [OK]
2025-11-29 23:15:17,027 [16/87] Disassembling C019... [OK]
2025-11-29 23:15:17,027 [17/87] Disassembling C015... [OK]
2025-11-29 23:15:17,027 [18/87] Disassembling C013... [OK]
2025-11-29 23:15:17,027 [19/87] Disassembling C021... [OK]
2025-11-29 23:15:17,027 [20/87] Disassembling C018... [OK]
2025-11-29 23:15:17,027 [21/87] Disassembling C030... [OK]
2025-11-29 23:15:17,027 [22/87] Disassembling C025... [OK]
2025-11-29 23:15:17,027 [23/87] Disassembling C026... [OK]
2025-11-29 23:15:17,027 [24/87] Disassembling C023... [OK]
2025-11-29 23:15:17,027 [25/87] Disassembling C024... [OK]
2025-11-29 23:15:17,027 [26/87] Disassembling C028... [OK]
2025-11-29 23:15:17,027 [27/87] Disassembling C055... [OK]
2025-11-29 23:15:17,027 [28/87] Disassembling C062... [OK]
2025-11-29 23:15:17,027 [29/87] Disassembling C012... [OK]
2025-11-29 23:15:17,027 [30/87] Disassembling C054... [OK]
2025-11-29 23:15:17,027 [31/87] Disassembling C027... [OK]
2025-11-29 23:15:17,027 [32/87] Disassembling C048... [OK]
2025-11-29 23:15:17,027 [33/87] Disassembling C020... [OK]
2025-11-29 23:15:17,027 [34/87] Disassembling C036... [OK]
2025-11-29 23:15:17,027 [35/87] Disassembling C029... [OK]
2025-11-29 23:15:17,027 [36/87] Disassembling C042... [OK]
2025-11-29 23:15:17,027 [37/87] Disassembling C072... [OK]
2025-11-29 23:15:17,027 [38/87] Disassembling C022... [OK]
2025-11-29 23:15:17,027 [39/87] Disassembling C058... [OK]
2025-11-29 23:15:17,027 [40/87] Disassembling C051... [OK]
2025-11-29 23:15:17,027 [41/87] Disassembling C033... [OK]
2025-11-29 23:15:17,027 [42/87] Disassembling C070... [OK]
2025-11-29 23:15:17,027 [43/87] Disassembling C065... [OK]
2025-11-29 23:15:17,027 [44/87] Disassembling C038... [OK]
2025-11-29 23:15:17,027 [45/87] Disassembling C053... [OK]
2025-11-29 23:15:17,027 [46/87] Disassembling C037... [OK]
2025-11-29 23:15:17,027 [47/87] Disassembling C056... [OK]
2025-11-29 23:15:17,029 [48/87] Disassembling C069... [OK]
2025-11-29 23:15:17,029 [49/87] Disassembling C057... [OK]
2025-11-29 23:15:17,029 [50/87] Disassembling C041... [OK]
2025-11-29 23:15:17,029 [51/87] Disassembling C060... [OK]
2025-11-29 23:15:17,029 [52/87] Disassembling C034... [OK]
2025-11-29 23:15:17,029 [53/87] Disassembling C031... [OK]
2025-11-29 23:15:17,029 [54/87] Disassembling C061... [OK]
2025-11-29 23:15:17,029 [55/87] Disassembling C043... [OK]
2025-11-29 23:15:17,029 [56/87] Disassembling C050... [OK]
2025-11-29 23:15:17,029 [57/87] Disassembling C047... [OK]
2025-11-29 23:15:17,029 [58/87] Disassembling C040... [OK]
2025-11-29 23:15:17,029 [59/87] Disassembling C071... [OK]
2025-11-29 23:15:17,029 [60/87] Disassembling C067... [OK]
2025-11-29 23:15:17,029 [61/87] Disassembling C032... [OK]
2025-11-29 23:15:17,029 [62/87] Disassembling C044... [OK]
2025-11-29 23:15:17,029 [63/87] Disassembling C059... [OK]
2025-11-29 23:15:17,029 [64/87] Disassembling C052... [OK]
2025-11-29 23:15:17,029 [65/87] Disassembling C068... [OK]
2025-11-29 23:15:17,029 [66/87] Disassembling C045... [OK]
2025-11-29 23:15:17,029 [67/87] Disassembling C076... [OK]
2025-11-29 23:15:17,029 [68/87] Disassembling C075... [OK]
2025-11-29 23:15:17,029 [69/87] Disassembling C064... [OK]
2025-11-29 23:15:17,029 [70/87] Disassembling C063... [OK]
2025-11-29 23:15:17,029 [71/87] Disassembling C046... [OK]
2025-11-29 23:15:17,029 [72/87] Disassembling C039... [OK]
2025-11-29 23:15:17,029 [73/87] Disassembling C077... [OK]
2025-11-29 23:15:17,029 [74/87] Disassembling C049... [OK]
2025-11-29 23:15:17,029 [75/87] Disassembling C079... [OK]
2025-11-29 23:15:17,029 [76/87] Disassembling C066... [OK]
2025-11-29 23:15:17,030 [77/87] Disassembling C074... [OK]
2025-11-29 23:15:17,030 [78/87] Disassembling C073... [OK]
2025-11-29 23:15:17,030 [79/87] Disassembling C035... [OK]
2025-11-29 23:15:17,030 [80/87] Disassembling C078... [OK]
2025-11-29 23:15:17,030 [81/87] Disassembling C080... [OK]
2025-11-29 23:15:17,030 [82/87] Disassembling C081... [OK]
2025-11-29 23:15:17,030 [83/87] Disassembling C082... [OK]
2025-11-29 23:15:17,030 [84/87] Disassembling C084... [OK]
2025-11-29 23:15:17,030 [85/87] Disassembling C083... [OK]
2025-11-29 23:15:17,030 [86/87] Disassembling C085... [OK]
2025-11-29 23:15:17,030 [87/87] Disassembling C086... [OK]
2025-11-29 23:15:17,030 [2/4] Failure scenario loaded: 1 failure(s)
2025-11-29 23:15:17,030 [3/4] Executing adaptive scheduler...
2025-11-29 23:15:17,081 [FUZZY] Symptom: ACCESS_BLOCKED
2025-11-29 23:15:17,081 [FUZZY] Inputs: force=60.0, torque=40.0, p_fail=60.0, context=0.0
2025-11-29 23:15:17,081 [FUZZY] Score: 40.00
2025-11-29 23:15:17,081 [FUZZY] Decision: bypass (confidence=100.0%)
2025-11-29 23:15:17,081 [ACTION] bypass: success=False, notes=Aucun chemin alternatif dans le graphe.
2025-11-29 23:15:17,117 Adaptive scheduler finished. Actions taken: 2
2025-11-29 23:15:17,117 EXECUTION SUMMARY
2025-11-29 23:15:17,117 Status: SUCCESS
2025-11-29 23:15:17,117 Target components:
2025-11-29 23:15:17,117 [OK] C086 - Successfully disassembled
2025-11-29 23:15:17,117 Execution metrics:
2025-11-29 23:15:17,117 Targets achieved: 1/1 (100.0%)
2025-11-29 23:15:17,117 Failures handled: 1
2025-11-29 23:15:17,117 Actions taken: 2
2025-11-29 23:15:17,117 Components done: 86/87
2025-11-29 23:15:17,117 Locked: 1 component(s)
2025-11-29 23:15:17,117 Execution time: 0.28s
2025-11-29 23:15:17,117 Actions breakdown:
2025-11-29 23:15:17,117 [FAILED] C047     ACCESS_BLOCKED       -> bypass      
2025-11-29 23:15:17,118 [OK] C047     ACCESS_BLOCKED       -> bypass\u2192replan
2025-11-29 23:15:17,118 Detailed logs: results\save\test_failures\scholl_mukherje_n=94\simple
2025-11-29 23:15:17,121 Pipeline finished successfully
