2025-11-29 23:16:57,748 DSP ADAPTIVE PIPELINE - SCHOLL_ARC111_N=111
2025-11-29 23:16:57,749 Loaded instance: scholl_arc111_n=111
2025-11-29 23:16:57,768 Loaded failures: 3
2025-11-29 23:16:57,768 [1/4] Loading instance and solving DSP...
2025-11-29 23:16:58,028 Nodes: 111, Edges: 176, Targets: 1, Solution: 111 operations
2025-11-29 23:16:58,028 Target(s) to achieve: ['C110']
2025-11-29 23:16:58,028 Starting disassembly sequence (111 operations)...
2025-11-29 23:16:58,028 [ 1/111] Disassembling C000... [OK]
2025-11-29 23:16:58,028 [ 2/111] Disassembling C001... [OK]
2025-11-29 23:16:58,028 [ 3/111] Disassembling C002... [OK]
2025-11-29 23:16:58,028 [ 4/111] Disassembling C003... [OK]
2025-11-29 23:16:58,028 [ 5/111] Disassembling C004... [OK]
2025-11-29 23:16:58,028 [ 6/111] Disassembling C005... [OK]
2025-11-29 23:16:58,028 [ 7/111] Disassembling C009... [OK]
2025-11-29 23:16:58,028 [ 8/111] Disassembling C006... [OK]
2025-11-29 23:16:58,028 [ 9/111] Disassembling C008... [OK]
2025-11-29 23:16:58,028 [10/111] Disassembling C011... [OK]
2025-11-29 23:16:58,028 [11/111] Disassembling C010... [OK]
2025-11-29 23:16:58,028 [12/111] Disassembling C017... [OK]
2025-11-29 23:16:58,028 [13/111] Disassembling C020... [OK]
2025-11-29 23:16:58,028 [14/111] Disassembling C015... [OK]
2025-11-29 23:16:58,028 [15/111] Disassembling C018... [OK]
2025-11-29 23:16:58,028 [16/111] Disassembling C013... [OK]
2025-11-29 23:16:58,028 [17/111] Disassembling C022... [OK]
2025-11-29 23:16:58,028 [18/111] Disassembling C016... [OK]
2025-11-29 23:16:58,028 [19/111] Disassembling C023... [OK]
2025-11-29 23:16:58,028 [20/111] Disassembling C012... [OK]
2025-11-29 23:16:58,028 [21/111] Disassembling C007... [OK]
2025-11-29 23:16:58,028 [22/111] Disassembling C019... [OK]
2025-11-29 23:16:58,028 [23/111] Disassembling C027... [OK]
2025-11-29 23:16:58,028 [24/111] Disassembling C029... [OK]
2025-11-29 23:16:58,028 [25/111] Disassembling C028... [OK]
2025-11-29 23:16:58,028 [26/111] Disassembling C031... [OK]
2025-11-29 23:16:58,028 [27/111] Disassembling C014... [OK]
2025-11-29 23:16:58,028 [28/111] Disassembling C032... [OK]
2025-11-29 23:16:58,028 [29/111] Disassembling C040... [OK]
2025-11-29 23:16:58,028 [30/111] Disassembling C035... [OK]
2025-11-29 23:16:58,028 [31/111] Disassembling C025... [OK]
2025-11-29 23:16:58,028 [32/111] Disassembling C036... [OK]
2025-11-29 23:16:58,028 [33/111] Disassembling C021... [OK]
2025-11-29 23:16:58,028 [34/111] Disassembling C043... [OK]
2025-11-29 23:16:58,028 [35/111] Disassembling C049... [OK]
2025-11-29 23:16:58,028 [36/111] Disassembling C024... [OK]
2025-11-29 23:16:58,028 [37/111] Disassembling C026... [OK]
2025-11-29 23:16:58,028 [38/111] Disassembling C044... [OK]
2025-11-29 23:16:58,028 [39/111] Disassembling C030... [OK]
2025-11-29 23:16:58,028 [40/111] Disassembling C037... [OK]
2025-11-29 23:16:58,028 [41/111] Disassembling C045... [OK]
2025-11-29 23:16:58,028 [42/111] Disassembling C051... [OK]
2025-11-29 23:16:58,028 [43/111] Disassembling C050... [OK]
2025-11-29 23:16:58,028 [44/111] Disassembling C034... [OK]
2025-11-29 23:16:58,028 [45/111] Disassembling C033... [OK]
2025-11-29 23:16:58,028 [46/111] Disassembling C042... [OK]
2025-11-29 23:16:58,028 [47/111] Disassembling C041... [OK]
2025-11-29 23:16:58,028 [48/111] Disassembling C038... [OK]
2025-11-29 23:16:58,028 [49/111] Disassembling C048... [OK]
2025-11-29 23:16:58,028 [50/111] Disassembling C039... [OK]
2025-11-29 23:16:58,028 [51/111] Disassembling C047... [OK]
2025-11-29 23:16:58,028 [52/111] Disassembling C046... [OK]
2025-11-29 23:16:58,028 [53/111] Disassembling C052... [OK]
2025-11-29 23:16:58,028 [54/111] Disassembling C057... [OK]
2025-11-29 23:16:58,028 [55/111] Disassembling C056... [OK]
2025-11-29 23:16:58,028 [56/111] Disassembling C065... [OK]
2025-11-29 23:16:58,028 [57/111] Disassembling C058... [OK]
2025-11-29 23:16:58,028 [58/111] Disassembling C054... [OK]
2025-11-29 23:16:58,028 [59/111] Disassembling C066... [OK]
2025-11-29 23:16:58,028 [60/111] Disassembling C060... [OK]
2025-11-29 23:16:58,028 [61/111] Disassembling C064... [OK]
2025-11-29 23:16:58,028 [62/111] Disassembling C053... [OK]
2025-11-29 23:16:58,028 [63/111] Disassembling C069... [OK]
2025-11-29 23:16:58,028 [64/111] Disassembling C059... [OK]
2025-11-29 23:16:58,028 [65/111] Disassembling C055... [OK]
2025-11-29 23:16:58,028 [66/111] Disassembling C063... [OK]
2025-11-29 23:16:58,028 [67/111] Disassembling C071... [OK]
2025-11-29 23:16:58,028 [68/111] Disassembling C068... [OK]
2025-11-29 23:16:58,028 [69/111] Disassembling C062... [OK]
2025-11-29 23:16:58,028 [70/111] Disassembling C073... [OK]
2025-11-29 23:16:58,028 [71/111] Disassembling C061... [OK]
2025-11-29 23:16:58,028 [72/111] Disassembling C075... [OK]
2025-11-29 23:16:58,028 [73/111] Disassembling C067... [OK]
2025-11-29 23:16:58,028 [74/111] Disassembling C070... [OK]
2025-11-29 23:16:58,028 [75/111] Disassembling C072... [OK]
2025-11-29 23:16:58,028 [76/111] Disassembling C079... [OK]
2025-11-29 23:16:58,028 [77/111] Disassembling C074... [OK]
2025-11-29 23:16:58,028 [78/111] Disassembling C078... [OK]
2025-11-29 23:16:58,028 [79/111] Disassembling C077... [OK]
2025-11-29 23:16:58,028 [80/111] Disassembling C080... [OK]
2025-11-29 23:16:58,028 [81/111] Disassembling C083... [OK]
2025-11-29 23:16:58,028 [82/111] Disassembling C086... [OK]
2025-11-29 23:16:58,028 [83/111] Disassembling C084... [OK]
2025-11-29 23:16:58,028 [84/111] Disassembling C081... [OK]
2025-11-29 23:16:58,028 [85/111] Disassembling C087... [OK]
2025-11-29 23:16:58,028 [86/111] Disassembling C076... [OK]
2025-11-29 23:16:58,028 [87/111] Disassembling C088... [OK]
2025-11-29 23:16:58,028 [88/111] Disassembling C085... [OK]
2025-11-29 23:16:58,028 [89/111] Disassembling C082... [OK]
2025-11-29 23:16:58,028 [90/111] Disassembling C090... [OK]
2025-11-29 23:16:58,028 [91/111] Disassembling C091... [OK]
2025-11-29 23:16:58,028 [92/111] Disassembling C093... [OK]
2025-11-29 23:16:58,028 [93/111] Disassembling C089... [OK]
2025-11-29 23:16:58,028 [94/111] Disassembling C092... [OK]
2025-11-29 23:16:58,028 [95/111] Disassembling C094... [OK]
2025-11-29 23:16:58,028 [96/111] Disassembling C103... [OK]
2025-11-29 23:16:58,028 [97/111] Disassembling C097... [OK]
2025-11-29 23:16:58,028 [98/111] Disassembling C098... [OK]
2025-11-29 23:16:58,028 [99/111] Disassembling C099... [OK]
2025-11-29 23:16:58,028 [100/111] Disassembling C096... [OK]
2025-11-29 23:16:58,028 [101/111] Disassembling C102... [OK]
2025-11-29 23:16:58,028 [102/111] Disassembling C107... [OK]
2025-11-29 23:16:58,028 [103/111] Disassembling C101... [OK]
2025-11-29 23:16:58,028 [104/111] Disassembling C109... [OK]
2025-11-29 23:16:58,028 [105/111] Disassembling C106... [OK]
2025-11-29 23:16:58,028 [106/111] Disassembling C105... [OK]
2025-11-29 23:16:58,028 [107/111] Disassembling C108... [OK]
2025-11-29 23:16:58,028 [108/111] Disassembling C095... [OK]
2025-11-29 23:16:58,028 [109/111] Disassembling C100... [OK]
2025-11-29 23:16:58,028 [110/111] Disassembling C104... [OK]
2025-11-29 23:16:58,028 [111/111] Disassembling C110... [OK]
2025-11-29 23:16:58,028 [2/4] Failure scenario loaded: 3 failure(s)
2025-11-29 23:16:58,028 [3/4] Executing adaptive scheduler...
2025-11-29 23:16:58,091 [FUZZY] Symptom: ACCESS_BLOCKED
2025-11-29 23:16:58,091 [FUZZY] Inputs: force=60.0, torque=40.0, p_fail=60.0, context=0.0
2025-11-29 23:16:58,091 [FUZZY] Score: 40.00
2025-11-29 23:16:58,091 [FUZZY] Decision: bypass (confidence=100.0%)
2025-11-29 23:16:58,091 [ACTION] bypass: success=True, notes=Component C050 bypassed.
2025-11-29 23:16:58,115 [FUZZY] Symptom: LOW_VALUE_BOTTLENECK
2025-11-29 23:16:58,115 [FUZZY] Inputs: force=30.0, torque=20.0, p_fail=60.0, context=0.0
2025-11-29 23:16:58,115 [FUZZY] Score: 40.00
2025-11-29 23:16:58,115 [FUZZY] Decision: bypass (confidence=100.0%)
2025-11-29 23:16:58,115 [ACTION] bypass: success=False, notes=Aucun chemin alternatif dans le graphe.
2025-11-29 23:16:58,258 [FUZZY] Symptom: ACCESS_BLOCKED
2025-11-29 23:16:58,258 [FUZZY] Inputs: force=60.0, torque=40.0, p_fail=70.0, context=0.0
2025-11-29 23:16:58,258 [FUZZY] Score: 56.71
2025-11-29 23:16:58,258 [FUZZY] Decision: destroy (confidence=74.3%)
2025-11-29 23:16:58,263 [ACTION] destroy: success=False, notes=Destruction non autorisée : Profit=32.00 > seuil=22.00 (percentile 20e).
2025-11-29 23:16:58,400 Adaptive scheduler finished. Actions taken: 5
2025-11-29 23:16:58,400 EXECUTION SUMMARY
2025-11-29 23:16:58,400 Status: SUCCESS
2025-11-29 23:16:58,400 Target components:
2025-11-29 23:16:58,400 [OK] C110 - Successfully disassembled
2025-11-29 23:16:58,400 Execution metrics:
2025-11-29 23:16:58,400 Targets achieved: 1/1 (100.0%)
2025-11-29 23:16:58,400 Failures handled: 3
2025-11-29 23:16:58,400 Actions taken: 5
2025-11-29 23:16:58,400 Components done: 108/111
2025-11-29 23:16:58,400 Locked: 3 component(s)
2025-11-29 23:16:58,400 Execution time: 0.65s
2025-11-29 23:16:58,400 Actions breakdown:
2025-11-29 23:16:58,400 [OK] C050     ACCESS_BLOCKED       -> bypass      
2025-11-29 23:16:58,400 [FAILED] C058     LOW_VALUE_BOTTLENECK -> bypass      
2025-11-29 23:16:58,400 [OK] C058     LOW_VALUE_BOTTLENECK -> bypass\u2192replan
2025-11-29 23:16:58,400 [FAILED] C053     ACCESS_BLOCKED       -> destroy     
2025-11-29 23:16:58,400 [OK] C053     ACCESS_BLOCKED       -> destroy\u2192replan
2025-11-29 23:16:58,400 Detailed logs: results\save\test_failures\scholl_arc111_n=111\complex
2025-11-29 23:16:58,400 Pipeline finished successfully
