2025-11-29 22:24:21,726 DSP ADAPTIVE PIPELINE - SCHOLL_ARC83_N=83
2025-11-29 22:24:21,726 Loaded instance: scholl_arc83_n=83
2025-11-29 22:24:21,726 Loaded failures: 0
2025-11-29 22:24:21,726 [1/4] Loading instance and solving DSP...
2025-11-29 22:24:21,878 Nodes: 83, Edges: 113, Targets: 1, Solution: 83 operations
2025-11-29 22:24:21,878 Target(s) to achieve: ['C082']
2025-11-29 22:24:21,878 Starting disassembly sequence (83 operations)...
2025-11-29 22:24:21,878 [ 1/83] Disassembling C000... [OK]
2025-11-29 22:24:21,878 [ 2/83] Disassembling C001... [OK]
2025-11-29 22:24:21,878 [ 3/83] Disassembling C003... [OK]
2025-11-29 22:24:21,878 [ 4/83] Disassembling C006... [OK]
2025-11-29 22:24:21,878 [ 5/83] Disassembling C010... [OK]
2025-11-29 22:24:21,878 [ 6/83] Disassembling C014... [OK]
2025-11-29 22:24:21,878 [ 7/83] Disassembling C004... [OK]
2025-11-29 22:24:21,878 [ 8/83] Disassembling C002... [OK]
2025-11-29 22:24:21,878 [ 9/83] Disassembling C007... [OK]
2025-11-29 22:24:21,878 [10/83] Disassembling C005... [OK]
2025-11-29 22:24:21,878 [11/83] Disassembling C009... [OK]
2025-11-29 22:24:21,878 [12/83] Disassembling C013... [OK]
2025-11-29 22:24:21,878 [13/83] Disassembling C012... [OK]
2025-11-29 22:24:21,878 [14/83] Disassembling C008... [OK]
2025-11-29 22:24:21,878 [15/83] Disassembling C018... [OK]
2025-11-29 22:24:21,878 [16/83] Disassembling C011... [OK]
2025-11-29 22:24:21,878 [17/83] Disassembling C023... [OK]
2025-11-29 22:24:21,878 [18/83] Disassembling C016... [OK]
2025-11-29 22:24:21,878 [19/83] Disassembling C019... [OK]
2025-11-29 22:24:21,878 [20/83] Disassembling C027... [OK]
2025-11-29 22:24:21,878 [21/83] Disassembling C021... [OK]
2025-11-29 22:24:21,878 [22/83] Disassembling C024... [OK]
2025-11-29 22:24:21,878 [23/83] Disassembling C031... [OK]
2025-11-29 22:24:21,878 [24/83] Disassembling C025... [OK]
2025-11-29 22:24:21,878 [25/83] Disassembling C017... [OK]
2025-11-29 22:24:21,878 [26/83] Disassembling C033... [OK]
2025-11-29 22:24:21,878 [27/83] Disassembling C034... [OK]
2025-11-29 22:24:21,878 [28/83] Disassembling C020... [OK]
2025-11-29 22:24:21,878 [29/83] Disassembling C022... [OK]
2025-11-29 22:24:21,878 [30/83] Disassembling C032... [OK]
2025-11-29 22:24:21,878 [31/83] Disassembling C026... [OK]
2025-11-29 22:24:21,878 [32/83] Disassembling C035... [OK]
2025-11-29 22:24:21,878 [33/83] Disassembling C015... [OK]
2025-11-29 22:24:21,878 [34/83] Disassembling C028... [OK]
2025-11-29 22:24:21,878 [35/83] Disassembling C029... [OK]
2025-11-29 22:24:21,878 [36/83] Disassembling C037... [OK]
2025-11-29 22:24:21,878 [37/83] Disassembling C036... [OK]
2025-11-29 22:24:21,878 [38/83] Disassembling C039... [OK]
2025-11-29 22:24:21,878 [39/83] Disassembling C030... [OK]
2025-11-29 22:24:21,878 [40/83] Disassembling C038... [OK]
2025-11-29 22:24:21,878 [41/83] Disassembling C041... [OK]
2025-11-29 22:24:21,878 [42/83] Disassembling C042... [OK]
2025-11-29 22:24:21,878 [43/83] Disassembling C040... [OK]
2025-11-29 22:24:21,878 [44/83] Disassembling C043... [OK]
2025-11-29 22:24:21,878 [45/83] Disassembling C045... [OK]
2025-11-29 22:24:21,878 [46/83] Disassembling C047... [OK]
2025-11-29 22:24:21,878 [47/83] Disassembling C049... [OK]
2025-11-29 22:24:21,878 [48/83] Disassembling C050... [OK]
2025-11-29 22:24:21,878 [49/83] Disassembling C051... [OK]
2025-11-29 22:24:21,878 [50/83] Disassembling C044... [OK]
2025-11-29 22:24:21,878 [51/83] Disassembling C046... [OK]
2025-11-29 22:24:21,878 [52/83] Disassembling C048... [OK]
2025-11-29 22:24:21,878 [53/83] Disassembling C068... [OK]
2025-11-29 22:24:21,878 [54/83] Disassembling C069... [OK]
2025-11-29 22:24:21,878 [55/83] Disassembling C071... [OK]
2025-11-29 22:24:21,878 [56/83] Disassembling C070... [OK]
2025-11-29 22:24:21,878 [57/83] Disassembling C052... [OK]
2025-11-29 22:24:21,878 [58/83] Disassembling C072... [OK]
2025-11-29 22:24:21,878 [59/83] Disassembling C053... [OK]
2025-11-29 22:24:21,878 [60/83] Disassembling C054... [OK]
2025-11-29 22:24:21,878 [61/83] Disassembling C055... [OK]
2025-11-29 22:24:21,878 [62/83] Disassembling C056... [OK]
2025-11-29 22:24:21,878 [63/83] Disassembling C057... [OK]
2025-11-29 22:24:21,878 [64/83] Disassembling C058... [OK]
2025-11-29 22:24:21,878 [65/83] Disassembling C059... [OK]
2025-11-29 22:24:21,878 [66/83] Disassembling C060... [OK]
2025-11-29 22:24:21,878 [67/83] Disassembling C061... [OK]
2025-11-29 22:24:21,878 [68/83] Disassembling C062... [OK]
2025-11-29 22:24:21,878 [69/83] Disassembling C063... [OK]
2025-11-29 22:24:21,878 [70/83] Disassembling C064... [OK]
2025-11-29 22:24:21,878 [71/83] Disassembling C065... [OK]
2025-11-29 22:24:21,878 [72/83] Disassembling C066... [OK]
2025-11-29 22:24:21,878 [73/83] Disassembling C067... [OK]
2025-11-29 22:24:21,878 [74/83] Disassembling C074... [OK]
2025-11-29 22:24:21,878 [75/83] Disassembling C073... [OK]
2025-11-29 22:24:21,878 [76/83] Disassembling C075... [OK]
2025-11-29 22:24:21,878 [77/83] Disassembling C077... [OK]
2025-11-29 22:24:21,878 [78/83] Disassembling C076... [OK]
2025-11-29 22:24:21,878 [79/83] Disassembling C078... [OK]
2025-11-29 22:24:21,878 [80/83] Disassembling C080... [OK]
2025-11-29 22:24:21,878 [81/83] Disassembling C079... [OK]
2025-11-29 22:24:21,878 [82/83] Disassembling C081... [OK]
2025-11-29 22:24:21,878 [83/83] Disassembling C082... [OK]
2025-11-29 22:24:21,878 [2/4] No failures (nominal execution)
2025-11-29 22:24:21,878 [3/4] Executing adaptive scheduler...
2025-11-29 22:24:21,878 Adaptive scheduler finished. Actions taken: 0
2025-11-29 22:24:21,878 EXECUTION SUMMARY
2025-11-29 22:24:21,878 Status: SUCCESS
2025-11-29 22:24:21,878 Target components:
2025-11-29 22:24:21,878 [OK] C082 - Successfully disassembled
2025-11-29 22:24:21,878 Execution metrics:
2025-11-29 22:24:21,878 Targets achieved: 1/1 (100.0%)
2025-11-29 22:24:21,878 Failures handled: 0
2025-11-29 22:24:21,878 Actions taken: 0
2025-11-29 22:24:21,878 Components done: 83/83
2025-11-29 22:24:21,878 Execution time: 0.15s
2025-11-29 22:24:21,878 Detailed logs: results\save\test_nominal\scholl_arc83_n=83
2025-11-29 22:24:21,878 Pipeline finished successfully
