2025-11-29 23:16:09,932 DSP ADAPTIVE PIPELINE - SCHOLL_ARC111_N=111
2025-11-29 23:16:09,932 Loaded instance: scholl_arc111_n=111
2025-11-29 23:16:09,942 Loaded failures: 2
2025-11-29 23:16:09,942 [1/4] Loading instance and solving DSP...
2025-11-29 23:16:10,177 Nodes: 111, Edges: 176, Targets: 1, Solution: 111 operations
2025-11-29 23:16:10,177 Target(s) to achieve: ['C110']
2025-11-29 23:16:10,177 Starting disassembly sequence (111 operations)...
2025-11-29 23:16:10,177 [ 1/111] Disassembling C000... [OK]
2025-11-29 23:16:10,177 [ 2/111] Disassembling C001... [OK]
2025-11-29 23:16:10,177 [ 3/111] Disassembling C002... [OK]
2025-11-29 23:16:10,192 [ 4/111] Disassembling C003... [OK]
2025-11-29 23:16:10,192 [ 5/111] Disassembling C006... [OK]
2025-11-29 23:16:10,192 [ 6/111] Disassembling C009... [OK]
2025-11-29 23:16:10,192 [ 7/111] Disassembling C008... [OK]
2025-11-29 23:16:10,192 [ 8/111] Disassembling C011... [OK]
2025-11-29 23:16:10,192 [ 9/111] Disassembling C010... [OK]
2025-11-29 23:16:10,192 [10/111] Disassembling C017... [OK]
2025-11-29 23:16:10,194 [11/111] Disassembling C015... [OK]
2025-11-29 23:16:10,194 [12/111] Disassembling C018... [OK]
2025-11-29 23:16:10,194 [13/111] Disassembling C028... [OK]
2025-11-29 23:16:10,194 [14/111] Disassembling C013... [OK]
2025-11-29 23:16:10,194 [15/111] Disassembling C029... [OK]
2025-11-29 23:16:10,194 [16/111] Disassembling C019... [OK]
2025-11-29 23:16:10,194 [17/111] Disassembling C024... [OK]
2025-11-29 23:16:10,194 [18/111] Disassembling C020... [OK]
2025-11-29 23:16:10,194 [19/111] Disassembling C016... [OK]
2025-11-29 23:16:10,194 [20/111] Disassembling C014... [OK]
2025-11-29 23:16:10,194 [21/111] Disassembling C033... [OK]
2025-11-29 23:16:10,194 [22/111] Disassembling C005... [OK]
2025-11-29 23:16:10,194 [23/111] Disassembling C041... [OK]
2025-11-29 23:16:10,194 [24/111] Disassembling C037... [OK]
2025-11-29 23:16:10,194 [25/111] Disassembling C023... [OK]
2025-11-29 23:16:10,194 [26/111] Disassembling C004... [OK]
2025-11-29 23:16:10,194 [27/111] Disassembling C045... [OK]
2025-11-29 23:16:10,194 [28/111] Disassembling C046... [OK]
2025-11-29 23:16:10,194 [29/111] Disassembling C056... [OK]
2025-11-29 23:16:10,194 [30/111] Disassembling C059... [OK]
2025-11-29 23:16:10,194 [31/111] Disassembling C067... [OK]
2025-11-29 23:16:10,194 [32/111] Disassembling C053... [OK]
2025-11-29 23:16:10,194 [33/111] Disassembling C051... [OK]
2025-11-29 23:16:10,194 [34/111] Disassembling C007... [OK]
2025-11-29 23:16:10,194 [35/111] Disassembling C027... [OK]
2025-11-29 23:16:10,194 [36/111] Disassembling C064... [OK]
2025-11-29 23:16:10,194 [37/111] Disassembling C025... [OK]
2025-11-29 23:16:10,194 [38/111] Disassembling C058... [OK]
2025-11-29 23:16:10,194 [39/111] Disassembling C066... [OK]
2025-11-29 23:16:10,194 [40/111] Disassembling C036... [OK]
2025-11-29 23:16:10,194 [41/111] Disassembling C055... [OK]
2025-11-29 23:16:10,194 [42/111] Disassembling C044... [OK]
2025-11-29 23:16:10,194 [43/111] Disassembling C035... [OK]
2025-11-29 23:16:10,194 [44/111] Disassembling C050... [OK]
2025-11-29 23:16:10,194 [45/111] Disassembling C043... [OK]
2025-11-29 23:16:10,194 [46/111] Disassembling C057... [OK]
2025-11-29 23:16:10,194 [47/111] Disassembling C054... [OK]
2025-11-29 23:16:10,194 [48/111] Disassembling C062... [OK]
2025-11-29 23:16:10,194 [49/111] Disassembling C022... [OK]
2025-11-29 23:16:10,194 [50/111] Disassembling C063... [OK]
2025-11-29 23:16:10,194 [51/111] Disassembling C021... [OK]
2025-11-29 23:16:10,194 [52/111] Disassembling C026... [OK]
2025-11-29 23:16:10,194 [53/111] Disassembling C034... [OK]
2025-11-29 23:16:10,194 [54/111] Disassembling C049... [OK]
2025-11-29 23:16:10,194 [55/111] Disassembling C042... [OK]
2025-11-29 23:16:10,194 [56/111] Disassembling C031... [OK]
2025-11-29 23:16:10,194 [57/111] Disassembling C065... [OK]
2025-11-29 23:16:10,194 [58/111] Disassembling C060... [OK]
2025-11-29 23:16:10,194 [59/111] Disassembling C012... [OK]
2025-11-29 23:16:10,194 [60/111] Disassembling C071... [OK]
2025-11-29 23:16:10,194 [61/111] Disassembling C048... [OK]
2025-11-29 23:16:10,194 [62/111] Disassembling C073... [OK]
2025-11-29 23:16:10,194 [63/111] Disassembling C032... [OK]
2025-11-29 23:16:10,194 [64/111] Disassembling C061... [OK]
2025-11-29 23:16:10,194 [65/111] Disassembling C040... [OK]
2025-11-29 23:16:10,194 [66/111] Disassembling C030... [OK]
2025-11-29 23:16:10,194 [67/111] Disassembling C075... [OK]
2025-11-29 23:16:10,194 [68/111] Disassembling C068... [OK]
2025-11-29 23:16:10,194 [69/111] Disassembling C080... [OK]
2025-11-29 23:16:10,194 [70/111] Disassembling C038... [OK]
2025-11-29 23:16:10,194 [71/111] Disassembling C081... [OK]
2025-11-29 23:16:10,194 [72/111] Disassembling C047... [OK]
2025-11-29 23:16:10,194 [73/111] Disassembling C086... [OK]
2025-11-29 23:16:10,194 [74/111] Disassembling C069... [OK]
2025-11-29 23:16:10,194 [75/111] Disassembling C079... [OK]
2025-11-29 23:16:10,194 [76/111] Disassembling C039... [OK]
2025-11-29 23:16:10,194 [77/111] Disassembling C089... [OK]
2025-11-29 23:16:10,194 [78/111] Disassembling C085... [OK]
2025-11-29 23:16:10,194 [79/111] Disassembling C070... [OK]
2025-11-29 23:16:10,194 [80/111] Disassembling C072... [OK]
2025-11-29 23:16:10,194 [81/111] Disassembling C074... [OK]
2025-11-29 23:16:10,194 [82/111] Disassembling C076... [OK]
2025-11-29 23:16:10,194 [83/111] Disassembling C052... [OK]
2025-11-29 23:16:10,194 [84/111] Disassembling C078... [OK]
2025-11-29 23:16:10,194 [85/111] Disassembling C082... [OK]
2025-11-29 23:16:10,194 [86/111] Disassembling C084... [OK]
2025-11-29 23:16:10,194 [87/111] Disassembling C077... [OK]
2025-11-29 23:16:10,194 [88/111] Disassembling C083... [OK]
2025-11-29 23:16:10,194 [89/111] Disassembling C087... [OK]
2025-11-29 23:16:10,194 [90/111] Disassembling C088... [OK]
2025-11-29 23:16:10,194 [91/111] Disassembling C090... [OK]
2025-11-29 23:16:10,194 [92/111] Disassembling C093... [OK]
2025-11-29 23:16:10,194 [93/111] Disassembling C092... [OK]
2025-11-29 23:16:10,194 [94/111] Disassembling C091... [OK]
2025-11-29 23:16:10,194 [95/111] Disassembling C094... [OK]
2025-11-29 23:16:10,194 [96/111] Disassembling C095... [OK]
2025-11-29 23:16:10,194 [97/111] Disassembling C100... [OK]
2025-11-29 23:16:10,194 [98/111] Disassembling C096... [OK]
2025-11-29 23:16:10,194 [99/111] Disassembling C103... [OK]
2025-11-29 23:16:10,194 [100/111] Disassembling C098... [OK]
2025-11-29 23:16:10,194 [101/111] Disassembling C101... [OK]
2025-11-29 23:16:10,194 [102/111] Disassembling C097... [OK]
2025-11-29 23:16:10,194 [103/111] Disassembling C099... [OK]
2025-11-29 23:16:10,194 [104/111] Disassembling C102... [OK]
2025-11-29 23:16:10,194 [105/111] Disassembling C104... [OK]
2025-11-29 23:16:10,194 [106/111] Disassembling C107... [OK]
2025-11-29 23:16:10,194 [107/111] Disassembling C109... [OK]
2025-11-29 23:16:10,194 [108/111] Disassembling C105... [OK]
2025-11-29 23:16:10,194 [109/111] Disassembling C108... [OK]
2025-11-29 23:16:10,194 [110/111] Disassembling C106... [OK]
2025-11-29 23:16:10,194 [111/111] Disassembling C110... [OK]
2025-11-29 23:16:10,194 [2/4] Failure scenario loaded: 2 failure(s)
2025-11-29 23:16:10,194 [3/4] Executing adaptive scheduler...
2025-11-29 23:16:10,239 [FUZZY] Symptom: ACCESS_BLOCKED
2025-11-29 23:16:10,239 [FUZZY] Inputs: force=60.0, torque=40.0, p_fail=70.0, context=0.0
2025-11-29 23:16:10,239 [FUZZY] Score: 56.71
2025-11-29 23:16:10,239 [FUZZY] Decision: destroy (confidence=74.3%)
2025-11-29 23:16:10,239 [ACTION] destroy: success=False, notes=Destruction non autorisée : Profit=83.00 > seuil=22.00 (percentile 20e).
2025-11-29 23:16:10,468 [FUZZY] Symptom: LOW_VALUE_BOTTLENECK
2025-11-29 23:16:10,468 [FUZZY] Inputs: force=30.0, torque=20.0, p_fail=60.0, context=0.0
2025-11-29 23:16:10,468 [FUZZY] Score: 40.00
2025-11-29 23:16:10,468 [FUZZY] Decision: bypass (confidence=100.0%)
2025-11-29 23:16:10,468 [ACTION] bypass: success=True, notes=Component C023 bypassed.
2025-11-29 23:16:10,468 Adaptive scheduler finished. Actions taken: 3
2025-11-29 23:16:10,468 EXECUTION SUMMARY
2025-11-29 23:16:10,468 Status: SUCCESS
2025-11-29 23:16:10,468 Target components:
2025-11-29 23:16:10,468 [OK] C110 - Successfully disassembled
2025-11-29 23:16:10,468 Execution metrics:
2025-11-29 23:16:10,468 Targets achieved: 1/1 (100.0%)
2025-11-29 23:16:10,468 Failures handled: 2
2025-11-29 23:16:10,468 Actions taken: 3
2025-11-29 23:16:10,468 Components done: 109/111
2025-11-29 23:16:10,468 Locked: 2 component(s)
2025-11-29 23:16:10,468 Execution time: 0.54s
2025-11-29 23:16:10,468 Actions breakdown:
2025-11-29 23:16:10,468 [FAILED] C019     ACCESS_BLOCKED       -> destroy     
2025-11-29 23:16:10,468 [OK] C019     ACCESS_BLOCKED       -> destroy\u2192replan
2025-11-29 23:16:10,468 [OK] C023     LOW_VALUE_BOTTLENECK -> bypass      
2025-11-29 23:16:10,468 Detailed logs: results\save\test_failures\scholl_arc111_n=111\intermediate
2025-11-29 23:16:10,472 Pipeline finished successfully
