2025-11-29 23:15:31,346 DSP ADAPTIVE PIPELINE - SCHOLL_BARTHOLD_N=148
2025-11-29 23:15:31,348 Loaded instance: scholl_barthold_n=148
2025-11-29 23:15:31,349 Loaded failures: 1
2025-11-29 23:15:31,349 [1/4] Loading instance and solving DSP...
2025-11-29 23:15:31,445 Nodes: 148, Edges: 175, Targets: 1, Solution: 56 operations
2025-11-29 23:15:31,445 Target(s) to achieve: ['C125']
2025-11-29 23:15:31,445 Starting disassembly sequence (56 operations)...
2025-11-29 23:15:31,445 [ 1/56] Disassembling C000... [OK]
2025-11-29 23:15:31,445 [ 2/56] Disassembling C058... [OK]
2025-11-29 23:15:31,445 [ 3/56] Disassembling C055... [OK]
2025-11-29 23:15:31,446 [ 4/56] Disassembling C073... [OK]
2025-11-29 23:15:31,446 [ 5/56] Disassembling C031... [OK]
2025-11-29 23:15:31,446 [ 6/56] Disassembling C001... [OK]
2025-11-29 23:15:31,446 [ 7/56] Disassembling C033... [OK]
2025-11-29 23:15:31,446 [ 8/56] Disassembling C002... [OK]
2025-11-29 23:15:31,446 [ 9/56] Disassembling C005... [OK]
2025-11-29 23:15:31,446 [10/56] Disassembling C004... [OK]
2025-11-29 23:15:31,446 [11/56] Disassembling C072... [OK]
2025-11-29 23:15:31,446 [12/56] Disassembling C032... [OK]
2025-11-29 23:15:31,446 [13/56] Disassembling C006... [OK]
2025-11-29 23:15:31,446 [14/56] Disassembling C074... [OK]
2025-11-29 23:15:31,446 [15/56] Disassembling C003... [OK]
2025-11-29 23:15:31,446 [16/56] Disassembling C008... [OK]
2025-11-29 23:15:31,446 [17/56] Disassembling C007... [OK]
2025-11-29 23:15:31,446 [18/56] Disassembling C009... [OK]
2025-11-29 23:15:31,446 [19/56] Disassembling C034... [OK]
2025-11-29 23:15:31,446 [20/56] Disassembling C013... [OK]
2025-11-29 23:15:31,446 [21/56] Disassembling C015... [OK]
2025-11-29 23:15:31,446 [22/56] Disassembling C014... [OK]
2025-11-29 23:15:31,446 [23/56] Disassembling C016... [OK]
2025-11-29 23:15:31,446 [24/56] Disassembling C017... [OK]
2025-11-29 23:15:31,447 [25/56] Disassembling C018... [OK]
2025-11-29 23:15:31,447 [26/56] Disassembling C019... [OK]
2025-11-29 23:15:31,447 [27/56] Disassembling C021... [OK]
2025-11-29 23:15:31,447 [28/56] Disassembling C022... [OK]
2025-11-29 23:15:31,447 [29/56] Disassembling C023... [OK]
2025-11-29 23:15:31,447 [30/56] Disassembling C020... [OK]
2025-11-29 23:15:31,447 [31/56] Disassembling C025... [OK]
2025-11-29 23:15:31,447 [32/56] Disassembling C026... [OK]
2025-11-29 23:15:31,447 [33/56] Disassembling C027... [OK]
2025-11-29 23:15:31,447 [34/56] Disassembling C024... [OK]
2025-11-29 23:15:31,447 [35/56] Disassembling C028... [OK]
2025-11-29 23:15:31,447 [36/56] Disassembling C030... [OK]
2025-11-29 23:15:31,447 [37/56] Disassembling C035... [OK]
2025-11-29 23:15:31,447 [38/56] Disassembling C036... [OK]
2025-11-29 23:15:31,447 [39/56] Disassembling C044... [OK]
2025-11-29 23:15:31,447 [40/56] Disassembling C037... [OK]
2025-11-29 23:15:31,447 [41/56] Disassembling C045... [OK]
2025-11-29 23:15:31,447 [42/56] Disassembling C046... [OK]
2025-11-29 23:15:31,447 [43/56] Disassembling C038... [OK]
2025-11-29 23:15:31,447 [44/56] Disassembling C039... [OK]
2025-11-29 23:15:31,447 [45/56] Disassembling C053... [OK]
2025-11-29 23:15:31,447 [46/56] Disassembling C089... [OK]
2025-11-29 23:15:31,447 [47/56] Disassembling C110... [OK]
2025-11-29 23:15:31,447 [48/56] Disassembling C111... [OK]
2025-11-29 23:15:31,447 [49/56] Disassembling C112... [OK]
2025-11-29 23:15:31,447 [50/56] Disassembling C115... [OK]
2025-11-29 23:15:31,447 [51/56] Disassembling C119... [OK]
2025-11-29 23:15:31,447 [52/56] Disassembling C120... [OK]
2025-11-29 23:15:31,447 [53/56] Disassembling C116... [OK]
2025-11-29 23:15:31,447 [54/56] Disassembling C117... [OK]
2025-11-29 23:15:31,447 [55/56] Disassembling C121... [OK]
2025-11-29 23:15:31,447 [56/56] Disassembling C125... [OK]
2025-11-29 23:15:31,447 [2/4] Failure scenario loaded: 1 failure(s)
2025-11-29 23:15:31,448 [3/4] Executing adaptive scheduler...
2025-11-29 23:15:31,496 [FUZZY] Symptom: ACCESS_BLOCKED
2025-11-29 23:15:31,496 [FUZZY] Inputs: force=60.0, torque=40.0, p_fail=50.0, context=0.0
2025-11-29 23:15:31,496 [FUZZY] Score: 40.00
2025-11-29 23:15:31,496 [FUZZY] Decision: bypass (confidence=100.0%)
2025-11-29 23:15:31,496 [ACTION] bypass: success=True, notes=Component C024 bypassed.
2025-11-29 23:15:31,496 Adaptive scheduler finished. Actions taken: 1
2025-11-29 23:15:31,497 EXECUTION SUMMARY
2025-11-29 23:15:31,497 Status: SUCCESS
2025-11-29 23:15:31,497 Target components:
2025-11-29 23:15:31,497 [OK] C125 - Successfully disassembled
2025-11-29 23:15:31,497 Execution metrics:
2025-11-29 23:15:31,497 Targets achieved: 1/1 (100.0%)
2025-11-29 23:15:31,497 Failures handled: 1
2025-11-29 23:15:31,497 Actions taken: 1
2025-11-29 23:15:31,497 Components done: 55/56
2025-11-29 23:15:31,497 Locked: 1 component(s)
2025-11-29 23:15:31,497 Execution time: 0.15s
2025-11-29 23:15:31,497 Actions breakdown:
2025-11-29 23:15:31,497 [OK] C024     ACCESS_BLOCKED       -> bypass      
2025-11-29 23:15:31,497 Detailed logs: results\save\test_failures\scholl_barthold_n=148\simple
2025-11-29 23:15:31,499 Pipeline finished successfully
